,,False,keanex,,,carcassonne,"[{'e': 'text', 't': 'Carcassonne'}]",2ac757ec-18aa-11e7-9d38-0e6585fc02e0,Carcassonne,dark,richtext,t2_573ne,,,False,False,,False,,False,1536061081.0,1536032281.0,,,,self.boardgames,0,False,0,False,False,9cs30s,False,False,False,False,True,False,,,,[],,,dark,text,False,,{},False,,,,[],t3_9cs30s,False,13,0,,False,all_ads,/r/boardgames/comments/9cs30s/shout_out_to_tiki_tiki_board_games_in_nj/,False,,,6,False,,,False,20,,{},"I've stopped in here 3-4 times now and they've always had a decent selection of board games, events, and other collectibles (MTG notably). I finally decided to check out their rental games and they had decent selection, but even better terms of rental. I don't know how other places do it, but I was able to rent **Clank! In Space.** for $5 for an entire week which felt like a great value to me. I've heard how good it is and $5 to rent a $40+ board game for 7 days seems like a great value to me before pulling the trigger on a game.

Now this was my first time renting and everything was *neatly* packed so I did my best to remember how it was packed when putting it away (will take pictures next time), and everything was in great shape. I will be checking here before considering any $40+ games to rent.

They also have a selection of new and used games with deals based on holidays. I saw a German version of **Castles of Burgundy - Card Game** and **Broom Service - Card Game** I considered buying but the ratings were mediocre.

I remembered seeing some expansions for **Scythe** and etc. Prices seem to be based on MSRP with deals to be had and they also do trade-ins. It's definitely worth checking out if you're in the area and checking out on Instagram where you can see new trade-ins and prices.","&lt;!-- SC_OFF --&gt;&lt;div class=""md""&gt;&lt;p&gt;I&amp;#39;ve stopped in here 3-4 times now and they&amp;#39;ve always had a decent selection of board games, events, and other collectibles (MTG notably). I finally decided to check out their rental games and they had decent selection, but even better terms of rental. I don&amp;#39;t know how other places do it, but I was able to rent &lt;strong&gt;Clank! In Space.&lt;/strong&gt; for $5 for an entire week which felt like a great value to me. I&amp;#39;ve heard how good it is and $5 to rent a $40+ board game for 7 days seems like a great value to me before pulling the trigger on a game.&lt;/p&gt;

&lt;p&gt;Now this was my first time renting and everything was &lt;em&gt;neatly&lt;/em&gt; packed so I did my best to remember how it was packed when putting it away (will take pictures next time), and everything was in great shape. I will be checking here before considering any $40+ games to rent.&lt;/p&gt;

&lt;p&gt;They also have a selection of new and used games with deals based on holidays. I saw a German version of &lt;strong&gt;Castles of Burgundy - Card Game&lt;/strong&gt; and &lt;strong&gt;Broom Service - Card Game&lt;/strong&gt; I considered buying but the ratings were mediocre.&lt;/p&gt;

&lt;p&gt;I remembered seeing some expansions for &lt;strong&gt;Scythe&lt;/strong&gt; and etc. Prices seem to be based on MSRP with deals to be had and they also do trade-ins. It&amp;#39;s definitely worth checking out if you&amp;#39;re in the area and checking out on Instagram where you can see new trade-ins and prices.&lt;/p&gt;
&lt;/div&gt;&lt;!-- SC_ON --&gt;",True,False,False,boardgames,t5_2qmjp,r/boardgames,902472,public,,self,,,"Shout out to Tiki Tiki Board Games in NJ (Gloucester County, near Cherry Hill) - Mod approved!",20,https://www.reddit.com/r/boardgames/comments/9cs30s/shout_out_to_tiki_tiki_board_games_in_nj/,[],,False,all_ads,6
,,False,duque269,,,,[],,,,text,t2_n9nk6,,,False,False,,False,,False,1536114388.0,1536085588.0,,,,self.boardgames,0,False,0,False,False,9cyc9j,False,False,False,False,True,False,,,,[],,,dark,text,False,,{},False,,,,[],t3_9cyc9j,True,13,0,,False,all_ads,/r/boardgames/comments/9cyc9j/where_to_buy_english_boardgames_in_prague_viena/,False,,,6,False,,,False,1,,{},Hi felow boardgamers! I will be in these 3 cities for holidays and I was wondering where I could purchase some boardgames. Where is the best (cheapest) place to do it? Thank you all in advance,"&lt;!-- SC_OFF --&gt;&lt;div class=""md""&gt;&lt;p&gt;Hi felow boardgamers! I will be in these 3 cities for holidays and I was wondering where I could purchase some boardgames. Where is the best (cheapest) place to do it? Thank you all in advance&lt;/p&gt;
&lt;/div&gt;&lt;!-- SC_ON --&gt;",True,False,False,boardgames,t5_2qmjp,r/boardgames,902472,public,,self,,,"Where to buy English boardgames in Prague, Viena and Budapest",1,https://www.reddit.com/r/boardgames/comments/9cyc9j/where_to_buy_english_boardgames_in_prague_viena/,[],,False,all_ads,6
,,False,drakkos,,,scrabble,"[{'e': 'text', 't': 'Meeple Like Us'}]",83b7554a-18ab-11e7-af02-0eac4db4cec8,Meeple Like Us,dark,richtext,t2_5c0kk,,,False,False,,False,,False,1536003849.0,1535975049.0,,,,meeplelikeus.co.uk,0,False,0,False,False,9cktd8,False,False,False,False,False,False,,,,[],,,dark,text,False,,{},False,,,,[],t3_9cktd8,False,32,0,,False,all_ads,/r/boardgames/comments/9cktd8/we_were_at_the_inaugural_tabletop_scotland_event/,False,link,"{'images': [{'source': {'url': 'https://i.redditmedia.com/PvYulbIj2yItoaYfY40az-1N6NWeKw7DMdAV57VaieM.jpg?s=1e6133a61f1d651d5695a3ce9cde028a', 'width': 758, 'height': 315}, 'resolutions': [{'url': 'https://i.redditmedia.com/PvYulbIj2yItoaYfY40az-1N6NWeKw7DMdAV57VaieM.jpg?fit=crop&amp;crop=faces%2Centropy&amp;arh=2&amp;w=108&amp;s=62c0590dcf168b2b2de1e14b345b74bd', 'width': 108, 'height': 44}, {'url': 'https://i.redditmedia.com/PvYulbIj2yItoaYfY40az-1N6NWeKw7DMdAV57VaieM.jpg?fit=crop&amp;crop=faces%2Centropy&amp;arh=2&amp;w=216&amp;s=96ab40c6575a319221e83db24fb93d52', 'width': 216, 'height': 89}, {'url': 'https://i.redditmedia.com/PvYulbIj2yItoaYfY40az-1N6NWeKw7DMdAV57VaieM.jpg?fit=crop&amp;crop=faces%2Centropy&amp;arh=2&amp;w=320&amp;s=36d01680712a6197f20a5163a3b6a9f8', 'width': 320, 'height': 132}, {'url': 'https://i.redditmedia.com/PvYulbIj2yItoaYfY40az-1N6NWeKw7DMdAV57VaieM.jpg?fit=crop&amp;crop=faces%2Centropy&amp;arh=2&amp;w=640&amp;s=56b48148a54da2750471a5a0a24d8d41', 'width': 640, 'height': 265}], 'variants': {}, 'id': '4D4dMnGbVh4lsVA6UaNmm-e4qEAv6R8Z7T0LkyvtbPU'}], 'enabled': False}",6,False,,,False,278,,{},,,False,False,False,boardgames,t5_2qmjp,r/boardgames,902472,public,,https://b.thumbs.redditmedia.com/GpRhRehuSaWAVpu5AAA5tBXM4RO9fj0k6XZsiej8DNE.jpg,58.0,140.0,We were at the inaugural Tabletop Scotland event this weekend - a game convention done very right!,278,http://meeplelikeus.co.uk/michaels-review-of-tabletop-scotland-2018/,[],,False,all_ads,6
,,False,rob132,,,space-alert,"[{'e': 'text', 't': 'Space Alert'}]",,Space Alert,dark,richtext,t2_4asgr,,,False,False,,False,,False,1536099380.0,1536070580.0,,,,self.boardgames,0,False,0,False,False,9cw03w,False,False,False,False,True,False,,,,[],,,dark,text,False,,{},False,,,,[],t3_9cw03w,False,36,0,,False,all_ads,/r/boardgames/comments/9cw03w/gloomhaven_end_of_scenario_looting/,False,,,6,False,,,False,3,,{},"I'm loving gloomhaven, but I can't stand the rule that says the game ends as soon as you meat the scenario conditions.  It's so stupid that I have to kite the last enemy around while I pick up loot.  It makes no thematic sense (too tired to pick up this coin), unless there were missions where they were turn limited (I haven't seen one yet)

&amp;#x200B;

I house rule it to say as long as you have cards left, you can spend 2 per turn to move and loot until your're ready to stop.  

&amp;#x200B;

It's still a race to grab the loot, so it's not like you won't loot as you go, plus I love the mad dash at the end as everyone tries to push past each other.","&lt;!-- SC_OFF --&gt;&lt;div class=""md""&gt;&lt;p&gt;I&amp;#39;m loving gloomhaven, but I can&amp;#39;t stand the rule that says the game ends as soon as you meat the scenario conditions.  It&amp;#39;s so stupid that I have to kite the last enemy around while I pick up loot.  It makes no thematic sense (too tired to pick up this coin), unless there were missions where they were turn limited (I haven&amp;#39;t seen one yet)&lt;/p&gt;

&lt;p&gt;&amp;#x200B;&lt;/p&gt;

&lt;p&gt;I house rule it to say as long as you have cards left, you can spend 2 per turn to move and loot until your&amp;#39;re ready to stop.  &lt;/p&gt;

&lt;p&gt;&amp;#x200B;&lt;/p&gt;

&lt;p&gt;It&amp;#39;s still a race to grab the loot, so it&amp;#39;s not like you won&amp;#39;t loot as you go, plus I love the mad dash at the end as everyone tries to push past each other.&lt;/p&gt;
&lt;/div&gt;&lt;!-- SC_ON --&gt;",True,False,False,boardgames,t5_2qmjp,r/boardgames,902472,public,,self,,,Gloomhaven end of scenario looting.,3,https://www.reddit.com/r/boardgames/comments/9cw03w/gloomhaven_end_of_scenario_looting/,[],,False,all_ads,6
,,False,demaxx27,,,,[],,,,text,t2_15whz8,,,False,False,,False,,False,1536139523.0,1536110723.0,,,,self.boardgames,0,False,0,False,False,9d1pth,False,False,False,False,True,False,,,,[],,,dark,text,False,,{},False,,,,[],t3_9d1pth,True,14,0,,False,all_ads,/r/boardgames/comments/9d1pth/i_should_not_have_looked_more_into_it/,False,,,6,False,,,False,0,,{},"I saw Root on kickstarter a while back. Didnt look interesting at first. Now everyone is talking about it. I resisted a lot. I knew the game was hyped. But then I watched videos of it and read the rules. Now I want it.
It looks so cool.

It did the same with Spirit Island. I wasnt really attracted at first but after a while I gave up and watched some videos and the next thing I know it was at my doorstep.


Yeah I know, shit post","&lt;!-- SC_OFF --&gt;&lt;div class=""md""&gt;&lt;p&gt;I saw Root on kickstarter a while back. Didnt look interesting at first. Now everyone is talking about it. I resisted a lot. I knew the game was hyped. But then I watched videos of it and read the rules. Now I want it.
It looks so cool.&lt;/p&gt;

&lt;p&gt;It did the same with Spirit Island. I wasnt really attracted at first but after a while I gave up and watched some videos and the next thing I know it was at my doorstep.&lt;/p&gt;

&lt;p&gt;Yeah I know, shit post&lt;/p&gt;
&lt;/div&gt;&lt;!-- SC_ON --&gt;",True,False,False,boardgames,t5_2qmjp,r/boardgames,902472,public,,self,,,I should not have looked more into it,0,https://www.reddit.com/r/boardgames/comments/9d1pth/i_should_not_have_looked_more_into_it/,[],,False,all_ads,6
,,False,thebombdotcom,,,,[],,,,text,t2_4a8be,,,False,False,,False,,False,1536029867.0,1536001067.0,,,,self.boardgames,0,False,0,False,False,9co5nd,False,False,False,False,True,False,,,COMC,"[{'e': 'text', 't': 'COMC'}]",734914a6-426b-11e8-8511-0e863647358e,COMC,dark,richtext,False,,{},False,,,,[],t3_9co5nd,False,39,0,,False,all_ads,/r/boardgames/comments/9co5nd/comc_my_collection/,False,self,"{'images': [{'source': {'url': 'https://i.redditmedia.com/gsiDhApQp9VTAT3PL0Wx9C1ZSdXpkFgiu33WKCfCDc0.jpg?s=91f5bb98dd118cd57311f0b25a778687', 'width': 1536, 'height': 2048}, 'resolutions': [{'url': 'https://i.redditmedia.com/gsiDhApQp9VTAT3PL0Wx9C1ZSdXpkFgiu33WKCfCDc0.jpg?fit=crop&amp;crop=faces%2Centropy&amp;arh=2&amp;w=108&amp;s=f2fcb39686e280cf7125887b078c1f37', 'width': 108, 'height': 144}, {'url': 'https://i.redditmedia.com/gsiDhApQp9VTAT3PL0Wx9C1ZSdXpkFgiu33WKCfCDc0.jpg?fit=crop&amp;crop=faces%2Centropy&amp;arh=2&amp;w=216&amp;s=60964b3d28eee2398b0c746bd2f2e279', 'width': 216, 'height': 288}, {'url': 'https://i.redditmedia.com/gsiDhApQp9VTAT3PL0Wx9C1ZSdXpkFgiu33WKCfCDc0.jpg?fit=crop&amp;crop=faces%2Centropy&amp;arh=2&amp;w=320&amp;s=b64f7095e82a55704f64668e615e1ae2', 'width': 320, 'height': 426}, {'url': 'https://i.redditmedia.com/gsiDhApQp9VTAT3PL0Wx9C1ZSdXpkFgiu33WKCfCDc0.jpg?fit=crop&amp;crop=faces%2Centropy&amp;arh=2&amp;w=640&amp;s=d68e8e8feff46fe370223aa29b8d522e', 'width': 640, 'height': 853}, {'url': 'https://i.redditmedia.com/gsiDhApQp9VTAT3PL0Wx9C1ZSdXpkFgiu33WKCfCDc0.jpg?fit=crop&amp;crop=faces%2Centropy&amp;arh=2&amp;w=960&amp;s=134785460786bf4af71e05d586c4f0ca', 'width': 960, 'height': 1280}, {'url': 'https://i.redditmedia.com/gsiDhApQp9VTAT3PL0Wx9C1ZSdXpkFgiu33WKCfCDc0.jpg?fit=crop&amp;crop=faces%2Centropy&amp;arh=2&amp;w=1080&amp;s=32bc4eb4c7368d97ce85ddc3124a527f', 'width': 1080, 'height': 1440}], 'variants': {}, 'id': 'DhVqgrC1MNW9X87xakMDCKHB9dQLc3aHUZiDpTCV2E8'}], 'enabled': False}",6,False,,,False,67,,{},"[https://imgur.com/gallery/GEXc5VY](https://imgur.com/gallery/GEXc5VY)

Iâ€™ve been in the hobby for about 4 years now, and the first games I bought were Ticket to Ride and Carcassonne after playing them at a friendâ€™s house. I was immediately hooked after seeing the depth of gaming that I was missing out on having only been raised on games like Monopoly and Sorry. 

One thing I plan on changing is building a built in shelf system for this wall specifically for the growing collection. That and Iâ€™ll probably pare down the collection more in the future as new games replace ones that donâ€™t hit the table anymore. 

Our current favorites are Everdell and Raiders of the North Sea. 

I can get pretty obsessed with organization, so a large number of these have third party game inserts, with Lords of Waterdeep and Scythe being the most upgraded of the collection. 

Anyway, just wanted to share with the community - thanks for being awesome!

","&lt;!-- SC_OFF --&gt;&lt;div class=""md""&gt;&lt;p&gt;&lt;a href=""https://imgur.com/gallery/GEXc5VY""&gt;https://imgur.com/gallery/GEXc5VY&lt;/a&gt;&lt;/p&gt;

&lt;p&gt;Iâ€™ve been in the hobby for about 4 years now, and the first games I bought were Ticket to Ride and Carcassonne after playing them at a friendâ€™s house. I was immediately hooked after seeing the depth of gaming that I was missing out on having only been raised on games like Monopoly and Sorry. &lt;/p&gt;

&lt;p&gt;One thing I plan on changing is building a built in shelf system for this wall specifically for the growing collection. That and Iâ€™ll probably pare down the collection more in the future as new games replace ones that donâ€™t hit the table anymore. &lt;/p&gt;

&lt;p&gt;Our current favorites are Everdell and Raiders of the North Sea. &lt;/p&gt;

&lt;p&gt;I can get pretty obsessed with organization, so a large number of these have third party game inserts, with Lords of Waterdeep and Scythe being the most upgraded of the collection. &lt;/p&gt;

&lt;p&gt;Anyway, just wanted to share with the community - thanks for being awesome!&lt;/p&gt;
&lt;/div&gt;&lt;!-- SC_ON --&gt;",True,False,False,boardgames,t5_2qmjp,r/boardgames,902472,public,,self,,,[COMC] My Collection!,67,https://www.reddit.com/r/boardgames/comments/9co5nd/comc_my_collection/,[],,False,all_ads,6
,,False,legothief,,,,[],,,,text,t2_7k2uq,,,False,False,,False,,False,1536018225.0,1535989425.0,,,,self.boardgames,0,False,0,False,False,9cmhod,False,False,False,False,True,False,,,,[],,,dark,text,False,,{},False,,,,[],t3_9cmhod,False,18,0,,False,all_ads,/r/boardgames/comments/9cmhod/full_english_rules_for_reykholt_an_upcoming_game/,False,self,"{'images': [{'source': {'url': 'https://i.redditmedia.com/q9xNKXTjDnjL4FgRKVXtJLzHpC8iBlm1qYMShZy3eLE.jpg?s=f38358c7baba447e82c804a57ac794cc', 'width': 630, 'height': 630}, 'resolutions': [{'url': 'https://i.redditmedia.com/q9xNKXTjDnjL4FgRKVXtJLzHpC8iBlm1qYMShZy3eLE.jpg?fit=crop&amp;crop=faces%2Centropy&amp;arh=2&amp;w=108&amp;s=da6b6a4c88d01423a3cb9b7f4b143a2b', 'width': 108, 'height': 108}, {'url': 'https://i.redditmedia.com/q9xNKXTjDnjL4FgRKVXtJLzHpC8iBlm1qYMShZy3eLE.jpg?fit=crop&amp;crop=faces%2Centropy&amp;arh=2&amp;w=216&amp;s=4a545f144bc151f69bce757f4968b0ce', 'width': 216, 'height': 216}, {'url': 'https://i.redditmedia.com/q9xNKXTjDnjL4FgRKVXtJLzHpC8iBlm1qYMShZy3eLE.jpg?fit=crop&amp;crop=faces%2Centropy&amp;arh=2&amp;w=320&amp;s=24a60637007608a21062fe068737ec68', 'width': 320, 'height': 320}], 'variants': {}, 'id': 'HLjLqBFa9uqI2uvb12f740-BUz0Nk-cFRkNXNVg629s'}], 'enabled': False}",6,False,,,False,48,,{},"[https://boardgamegeek.com/filepage/168357/reykholt-en-rules](https://boardgamegeek.com/filepage/168357/reykholt-en-rules)

&amp;#x200B;

After reading the rulebook, I'm pleasantly surprised by the art direction, relatively simple ruleset, and few twists, such as the action that forces your neighbor to share their cards with you. Not to mention, there seems to be a full campaign mode with light story elements sprinkled on top. 

&amp;#x200B;

Honestly, I'm pretty excited for this game! What do other people think?","&lt;!-- SC_OFF --&gt;&lt;div class=""md""&gt;&lt;p&gt;&lt;a href=""https://boardgamegeek.com/filepage/168357/reykholt-en-rules""&gt;https://boardgamegeek.com/filepage/168357/reykholt-en-rules&lt;/a&gt;&lt;/p&gt;

&lt;p&gt;&amp;#x200B;&lt;/p&gt;

&lt;p&gt;After reading the rulebook, I&amp;#39;m pleasantly surprised by the art direction, relatively simple ruleset, and few twists, such as the action that forces your neighbor to share their cards with you. Not to mention, there seems to be a full campaign mode with light story elements sprinkled on top. &lt;/p&gt;

&lt;p&gt;&amp;#x200B;&lt;/p&gt;

&lt;p&gt;Honestly, I&amp;#39;m pretty excited for this game! What do other people think?&lt;/p&gt;
&lt;/div&gt;&lt;!-- SC_ON --&gt;",True,False,False,boardgames,t5_2qmjp,r/boardgames,902472,public,,self,,,"Full English rules for Reykholt, an upcoming game by Uwe Rosenburg, has been posted",48,https://www.reddit.com/r/boardgames/comments/9cmhod/full_english_rules_for_reykholt_an_upcoming_game/,[],,False,all_ads,6
,,False,arbaumann,,,dead-of-winter,"[{'e': 'text', 't': 'Dead Of Winter-Is-Coming'}]",,Dead Of Winter-Is-Coming,dark,richtext,t2_j2pj6,,,False,False,,False,,False,1536051772.0,1536022972.0,,,,self.boardgames,0,False,0,False,False,9cr0gc,False,False,False,False,True,False,,,,[],,,dark,text,False,,{},False,,,,[],t3_9cr0gc,False,5,0,,False,all_ads,/r/boardgames/comments/9cr0gc/extra_duchess_table_topper/,False,self,"{'images': [{'source': {'url': 'https://i.redditmedia.com/5pd2yV2iB-NnrbHrixNKLSf0vUp5K5mumRei1fL3yWI.jpg?s=0eef42bef09cd29e17a1b52a6a3b9b43', 'width': 3120, 'height': 4160}, 'resolutions': [{'url': 'https://i.redditmedia.com/5pd2yV2iB-NnrbHrixNKLSf0vUp5K5mumRei1fL3yWI.jpg?fit=crop&amp;crop=faces%2Centropy&amp;arh=2&amp;w=108&amp;s=a75e2564541bfa3f0f423fc2b64fa810', 'width': 108, 'height': 144}, {'url': 'https://i.redditmedia.com/5pd2yV2iB-NnrbHrixNKLSf0vUp5K5mumRei1fL3yWI.jpg?fit=crop&amp;crop=faces%2Centropy&amp;arh=2&amp;w=216&amp;s=7837088bbaa288c475f841e47caaf266', 'width': 216, 'height': 288}, {'url': 'https://i.redditmedia.com/5pd2yV2iB-NnrbHrixNKLSf0vUp5K5mumRei1fL3yWI.jpg?fit=crop&amp;crop=faces%2Centropy&amp;arh=2&amp;w=320&amp;s=51426a330b67c6de4cc60d9ddaa4e8bc', 'width': 320, 'height': 426}, {'url': 'https://i.redditmedia.com/5pd2yV2iB-NnrbHrixNKLSf0vUp5K5mumRei1fL3yWI.jpg?fit=crop&amp;crop=faces%2Centropy&amp;arh=2&amp;w=640&amp;s=3136043de1603ad2febd15c48dcda16c', 'width': 640, 'height': 853}, {'url': 'https://i.redditmedia.com/5pd2yV2iB-NnrbHrixNKLSf0vUp5K5mumRei1fL3yWI.jpg?fit=crop&amp;crop=faces%2Centropy&amp;arh=2&amp;w=960&amp;s=2b88b523f29ddcedea2d5463adafa9e7', 'width': 960, 'height': 1280}, {'url': 'https://i.redditmedia.com/5pd2yV2iB-NnrbHrixNKLSf0vUp5K5mumRei1fL3yWI.jpg?fit=crop&amp;crop=faces%2Centropy&amp;arh=2&amp;w=1080&amp;s=86390f8f13a0cf0df9b527c193222f38', 'width': 1080, 'height': 1440}], 'variants': {}, 'id': 'LEz_C_mmDY3EDICpXh8AtrvyLdIvZ-a5BDbLdavXcdo'}], 'enabled': False}",6,False,,,False,9,,{}," I was a backer of the Duchess game table and when I received the table the topper I ordered had slight damage. I reported it and they sent me a brand new topper. 

Now I have 2 table toppers and am looking to have someone take the ""damaged"" topper off my hands. I have damage in quotes because the damage is not terribly noticeable. I live in the Atlanta, GA area so if you are interested you would need to be able to pick it up from my house. I'm not looking to make a profit or anything since I got my replacement totally free. I am just 9 months pregnant and want it out of my house and to go to someone who will enjoy it. Photos are at the link below. The damage includes a small zig-zag looking mark on the edge of one of the pieces and a small chip in the top corner of the other piece. 

 [http://imgur.com/a/S3Ou0qV](http://imgur.com/a/S3Ou0qV) ","&lt;!-- SC_OFF --&gt;&lt;div class=""md""&gt;&lt;p&gt;I was a backer of the Duchess game table and when I received the table the topper I ordered had slight damage. I reported it and they sent me a brand new topper. &lt;/p&gt;

&lt;p&gt;Now I have 2 table toppers and am looking to have someone take the &amp;quot;damaged&amp;quot; topper off my hands. I have damage in quotes because the damage is not terribly noticeable. I live in the Atlanta, GA area so if you are interested you would need to be able to pick it up from my house. I&amp;#39;m not looking to make a profit or anything since I got my replacement totally free. I am just 9 months pregnant and want it out of my house and to go to someone who will enjoy it. Photos are at the link below. The damage includes a small zig-zag looking mark on the edge of one of the pieces and a small chip in the top corner of the other piece. &lt;/p&gt;

&lt;p&gt;&lt;a href=""http://imgur.com/a/S3Ou0qV""&gt;http://imgur.com/a/S3Ou0qV&lt;/a&gt; &lt;/p&gt;
&lt;/div&gt;&lt;!-- SC_ON --&gt;",True,False,False,boardgames,t5_2qmjp,r/boardgames,902472,public,,self,,,Extra Duchess Table Topper,9,https://www.reddit.com/r/boardgames/comments/9cr0gc/extra_duchess_table_topper/,[],,False,all_ads,6
,,False,Cam2116,,,,[],,,,text,t2_1d0hvvcc,,,False,False,,False,,False,1536093990.0,1536065190.0,,,,self.boardgames,0,False,0,False,False,9cv9s5,False,False,False,False,True,False,,,,[],,,dark,text,False,,{},False,,,,[],t3_9cv9s5,True,8,0,,False,all_ads,/r/boardgames/comments/9cv9s5/pandemic_legacy_season_2_playable_more_than_once/,False,,,6,False,,,False,1,,{},"I have just finished the first season of pandemic legacy and I was wondering if I should buy the second one but was wondering if I could play it more than once like you can with the first. Anyone played it more than once ? 
And how was it ? ","&lt;!-- SC_OFF --&gt;&lt;div class=""md""&gt;&lt;p&gt;I have just finished the first season of pandemic legacy and I was wondering if I should buy the second one but was wondering if I could play it more than once like you can with the first. Anyone played it more than once ? 
And how was it ? &lt;/p&gt;
&lt;/div&gt;&lt;!-- SC_ON --&gt;",True,False,False,boardgames,t5_2qmjp,r/boardgames,902472,public,,self,,,Pandemic legacy season 2 playable more than once ??,1,https://www.reddit.com/r/boardgames/comments/9cv9s5/pandemic_legacy_season_2_playable_more_than_once/,[],,False,all_ads,6
,,False,fantseepants,,,,[],,,,text,t2_kd63z,,,False,False,,False,,False,1536009783.0,1535980983.0,,,,boardgamegeek.com,0,False,0,False,False,9clfnv,False,False,False,False,False,False,,,,[],,,dark,text,False,,{},False,,,,[],t3_9clfnv,False,2,0,,False,all_ads,/r/boardgames/comments/9clfnv/pax_pamir_second_edition_third_designer_diary_our/,False,link,"{'images': [{'source': {'url': 'https://i.redditmedia.com/eHhd0r30I6Vft7_12yv29F3XIeCOTtpNwA7ttKatyX8.jpg?s=4072f70f95826327896efaf3ac4f5564', 'width': 816, 'height': 630}, 'resolutions': [{'url': 'https://i.redditmedia.com/eHhd0r30I6Vft7_12yv29F3XIeCOTtpNwA7ttKatyX8.jpg?fit=crop&amp;crop=faces%2Centropy&amp;arh=2&amp;w=108&amp;s=357d02f3935adac7b6faf8c3a1fdfa24', 'width': 108, 'height': 83}, {'url': 'https://i.redditmedia.com/eHhd0r30I6Vft7_12yv29F3XIeCOTtpNwA7ttKatyX8.jpg?fit=crop&amp;crop=faces%2Centropy&amp;arh=2&amp;w=216&amp;s=86c62d838dbbb334e731525c245bf603', 'width': 216, 'height': 166}, {'url': 'https://i.redditmedia.com/eHhd0r30I6Vft7_12yv29F3XIeCOTtpNwA7ttKatyX8.jpg?fit=crop&amp;crop=faces%2Centropy&amp;arh=2&amp;w=320&amp;s=46ec48778025567bcde074822461aa37', 'width': 320, 'height': 247}, {'url': 'https://i.redditmedia.com/eHhd0r30I6Vft7_12yv29F3XIeCOTtpNwA7ttKatyX8.jpg?fit=crop&amp;crop=faces%2Centropy&amp;arh=2&amp;w=640&amp;s=d110c90c947fadc1d067f997fd2fe337', 'width': 640, 'height': 494}], 'variants': {}, 'id': 'OtPsiFPEG9xiOs65_fOSRCLBpT-Dm4WkrT8nP9PSfSc'}], 'enabled': False}",6,False,,,False,70,,{},,,True,False,False,boardgames,t5_2qmjp,r/boardgames,902472,public,,https://a.thumbs.redditmedia.com/sFZWSp48_L68Xv_n-vQKIhDQuY21Wpddx65vjb_sKd4.jpg,108.0,140.0,Pax Pamir Second Edition â€” Third Designer Diary (Our Man in Kabul),70,https://boardgamegeek.com/thread/2053389/designer-diary-our-man-kabul,[],,False,all_ads,6
,,False,drewdrewthis,,,,[],,,,text,t2_11ima14q,,,False,False,,False,,False,1536055085.0,1536026285.0,,,,self.boardgames,0,False,0,False,False,9crf1i,False,False,False,False,True,False,,,,[],,,dark,text,False,,{},False,,,,[],t3_9crf1i,True,7,0,,False,all_ads,/r/boardgames/comments/9crf1i/creative_werewolf_setups/,False,,,6,False,,,False,6,,{},"Iâ€™m trying to organize a party, and one of the things weâ€™re going to do is play a big game of Werewolf. Does anybody have any fun or creative role setups that would work with 17 people? ","&lt;!-- SC_OFF --&gt;&lt;div class=""md""&gt;&lt;p&gt;Iâ€™m trying to organize a party, and one of the things weâ€™re going to do is play a big game of Werewolf. Does anybody have any fun or creative role setups that would work with 17 people? &lt;/p&gt;
&lt;/div&gt;&lt;!-- SC_ON --&gt;",True,False,False,boardgames,t5_2qmjp,r/boardgames,902472,public,,self,,,Creative Werewolf setups?,6,https://www.reddit.com/r/boardgames/comments/9crf1i/creative_werewolf_setups/,[],,False,all_ads,6
