approved_at_utc,approved_by,archived,author,author_cakeday,author_flair_background_color,author_flair_css_class,author_flair_richtext,author_flair_template_id,author_flair_text,author_flair_text_color,author_flair_type,author_fullname,banned_at_utc,banned_by,can_gild,can_mod_post,category,clicked,content_categories,contest_mode,created,created_utc,crosspost_parent,crosspost_parent_list,distinguished,domain,downs,edited,gilded,hidden,hide_score,id,is_crosspostable,is_meta,is_original_content,is_reddit_media_domain,is_self,is_video,likes,link_flair_background_color,link_flair_css_class,link_flair_richtext,link_flair_template_id,link_flair_text,link_flair_text_color,link_flair_type,locked,media,media_embed,media_only,mod_note,mod_reason_by,mod_reason_title,mod_reports,name,no_follow,num_comments,num_crossposts,num_reports,over_18,parent_whitelist_status,permalink,pinned,post_hint,preview,pwls,quarantine,removal_reason,report_reasons,saved,score,secure_media,secure_media_embed,selftext,selftext_html,send_replies,spoiler,stickied,subreddit,subreddit_id,subreddit_name_prefixed,subreddit_subscribers,subreddit_type,suggested_sort,thumbnail,thumbnail_height,thumbnail_width,title,ups,url,user_reports,view_count,visited,whitelist_status,wls
,,False,AutoModerator,,#d0fffd,,"[{'e': 'text', 't': 'ðŸ¤–'}]",326005ee-9cf2-11e8-8b1f-0e8f9a199476,ðŸ¤–,dark,richtext,t2_6l4z3,,,False,False,,False,,False,1536177093.0,1536148293.0,,,moderator,self.boardgames,0,False,0,False,False,9d5r4a,False,False,False,False,True,False,,#4a4b4a,,"[{'e': 'text', 't': 'Daily Game Recs'}]",01476204-cd40-11e7-a8ba-0e829f432fc8,Daily Game Recs,light,richtext,False,,{},False,,,,[],t3_9d5r4a,True,64,1,,False,all_ads,/r/boardgames/comments/9d5r4a/rboardgames_daily_discussion_and_game/,False,,,6,False,,,False,16,,{},"**Welcome to /r/boardgames Daily Discussion and Game Recommendations**

This is meant to be a place where you can ask any and all questions relating to the board gaming world: general or specific game recommendations, rule clarifications, definitions of terms/acronyms, and other quick questions that might not warrant their own post. 

If you are seeking game recommendations you will get better responses if you give us enough background to help you. You can use [this template](https://www.reddit.com/r/boardgames/wiki/personalized-game-recommendation-template-no-explainer) to do so. [Here](https://www.reddit.com/r/boardgames/wiki/personalized-game-recommendation-template) is a version with explanations of what we're looking for.  

If you reply to any comment that has a game name in **bold** with ""**/u/r2d8 getparentinfo**"", one of our robots will tell you more about the game

Just remember that this is a community full of awesome, helpful people, and feel free to ask your questions whatever they may be. As always, keep it civil and remember what the downvote button is actually for.


Lastly, here are some of the resources available at /r/boardgames:

* If you are new here, be sure to check out our [Community Guidelines](https://www.reddit.com/r/boardgames/wiki/community)
* If you are looking for a game recommendation, make sure to read our [What Should I Get Wiki](https://www.reddit.com/r/boardgames/wiki/wsig)
* If asking people for recommendations is too interactive: [The Automated Recommendations Robot is here for you](https://www.reddit.com/r/boardgames/wiki/wsig#wiki_ask_a_robot_for_a_list_of_recommendations).
* Also take a look at our [Wiki Index](https://www.reddit.com/r/boardgames/wiki/index) for various other resources and information.
* Any questions about game design can be answered here, but also visit /r/tabletopgamedesign
* Any discussions about the subreddit itself should be contained in /r/metaboardgames

*If you use the boardgamerecommender bot in this thread, please reply to the stickied top comment in order to avoid cluttering up the posts.*

Happy gaming!
","&lt;!-- SC_OFF --&gt;&lt;div class=""md""&gt;&lt;p&gt;&lt;strong&gt;Welcome to &lt;a href=""/r/boardgames""&gt;/r/boardgames&lt;/a&gt; Daily Discussion and Game Recommendations&lt;/strong&gt;&lt;/p&gt;

&lt;p&gt;This is meant to be a place where you can ask any and all questions relating to the board gaming world: general or specific game recommendations, rule clarifications, definitions of terms/acronyms, and other quick questions that might not warrant their own post. &lt;/p&gt;

&lt;p&gt;If you are seeking game recommendations you will get better responses if you give us enough background to help you. You can use &lt;a href=""https://www.reddit.com/r/boardgames/wiki/personalized-game-recommendation-template-no-explainer""&gt;this template&lt;/a&gt; to do so. &lt;a href=""https://www.reddit.com/r/boardgames/wiki/personalized-game-recommendation-template""&gt;Here&lt;/a&gt; is a version with explanations of what we&amp;#39;re looking for.  &lt;/p&gt;

&lt;p&gt;If you reply to any comment that has a game name in &lt;strong&gt;bold&lt;/strong&gt; with &amp;quot;&lt;strong&gt;&lt;a href=""/u/r2d8""&gt;/u/r2d8&lt;/a&gt; getparentinfo&lt;/strong&gt;&amp;quot;, one of our robots will tell you more about the game&lt;/p&gt;

&lt;p&gt;Just remember that this is a community full of awesome, helpful people, and feel free to ask your questions whatever they may be. As always, keep it civil and remember what the downvote button is actually for.&lt;/p&gt;

&lt;p&gt;Lastly, here are some of the resources available at &lt;a href=""/r/boardgames""&gt;/r/boardgames&lt;/a&gt;:&lt;/p&gt;

&lt;ul&gt;
&lt;li&gt;If you are new here, be sure to check out our &lt;a href=""https://www.reddit.com/r/boardgames/wiki/community""&gt;Community Guidelines&lt;/a&gt;&lt;/li&gt;
&lt;li&gt;If you are looking for a game recommendation, make sure to read our &lt;a href=""https://www.reddit.com/r/boardgames/wiki/wsig""&gt;What Should I Get Wiki&lt;/a&gt;&lt;/li&gt;
&lt;li&gt;If asking people for recommendations is too interactive: &lt;a href=""https://www.reddit.com/r/boardgames/wiki/wsig#wiki_ask_a_robot_for_a_list_of_recommendations""&gt;The Automated Recommendations Robot is here for you&lt;/a&gt;.&lt;/li&gt;
&lt;li&gt;Also take a look at our &lt;a href=""https://www.reddit.com/r/boardgames/wiki/index""&gt;Wiki Index&lt;/a&gt; for various other resources and information.&lt;/li&gt;
&lt;li&gt;Any questions about game design can be answered here, but also visit &lt;a href=""/r/tabletopgamedesign""&gt;/r/tabletopgamedesign&lt;/a&gt;&lt;/li&gt;
&lt;li&gt;Any discussions about the subreddit itself should be contained in &lt;a href=""/r/metaboardgames""&gt;/r/metaboardgames&lt;/a&gt;&lt;/li&gt;
&lt;/ul&gt;

&lt;p&gt;&lt;em&gt;If you use the boardgamerecommender bot in this thread, please reply to the stickied top comment in order to avoid cluttering up the posts.&lt;/em&gt;&lt;/p&gt;

&lt;p&gt;Happy gaming!&lt;/p&gt;
&lt;/div&gt;&lt;!-- SC_ON --&gt;",False,False,True,boardgames,t5_2qmjp,r/boardgames,902470,public,new,self,,,"/r/boardgames Daily Discussion and Game Recommendations (September 05, 2018)",16,https://www.reddit.com/r/boardgames/comments/9d5r4a/rboardgames_daily_discussion_and_game/,[],,False,all_ads,6
,,False,foreigneternity,,,descent,"[{'e': 'text', 't': 'Descent 1E Forever!'}]",,Descent 1E Forever!,dark,richtext,t2_csnce,,,False,False,,False,,False,1536186136.0,1536157336.0,,,,self.boardgames,0,False,0,False,False,9d708k,False,False,False,False,True,False,,,,[],,,dark,text,False,,{},False,,,,[],t3_9d708k,False,64,0,,False,all_ads,/r/boardgames/comments/9d708k/10_things_you_should_know_before_buying_aeons_end/,False,,,6,False,,,False,207,,{},"Hello everyone,

This is my third installment of my weekly reddit post called 10 Things You Should Know, eventually to be shortened to 10TYSK. This week we're covering Aeon's End, a deck-building co-operative game by Kevin Riley, published by Action Phase Games and Indie Boards and Games. Each player acts as a mage trying to defeat an extremely powerful nemesis (think Cthulhu types) by casting spells into breaches to deal damage. If the nemesis' HP is drained or his/her deck is depleted before the nemesis destroys the mages or their city, the players win.

1. **If you love deckbuilding, but hate shuffling, this is the deckbuilder for you.** You never have to shuffle your deck, you just flip it over to restart it. This adds another layer of strategy as to how you arrange your discard pile to maximize your deck's efficiency and power.

2. **If you don't like deckbuilding, there isn't enough new game here to satisfy you.** I like to think of this game as a cross between Sentinels of the Multiverse and Big Book of Madness. If those games don't get you excited, this game probably won't either. However, I'm not a *huge* deck-builder guy in general, but this is my favorite one. I have also played Legendary Encounters Aliens, Marvel Legendary, Harry Potter Hogwarts Battle, Clank, Big Book of Madness, and Dominion. So I do have a little experience with the genre.

3. **Set up and take down are the worst parts of the game**, and eventually you may want to house rule the way you do this. Before each game you have to construct the deck for the nemesis, your individual starter decks, and you have to randomly build the market with 3 gems, 4 spells, and 2 relics. If you buy enough expansions, this will give a TON of options for each category. But you'll also eventually find that without certain types of gems, relics, spells, or player powers, winning a game is extremely difficult, if not impossible.

4. As with all co-op deckbuilders, **you may find some games more frustratingly difficult than others**. However, if you play co-op deck-builders, you probably already know this. Sometimes you just get a brutal combination of cards. This game doesn't suffer from Harry Potter-like problems where an opening villain combo means you just have to reshuffle before even attempting to beat them, but it can derail your game. The game does have built in tiers of card difficult like Legendary Aliens and Predator, so that helps.

5. **There are essentially two base games**: Aeon's End (AE) and War Eternal (WE). You can buy either one and have everything you need to play and add expansions to without buying the other. Buying both will give you double sets of only starter cards like sparks and crystal. Everything else will be unique, so if you want more variations in nemeses, nemeses base cards, spells, relics, or gems, go ahead and buy both.

5. **The artwork is nice, the insert is terrible**. If you love great inserts, you will find nothing of the kind in this game. It's cheap cardboard. I have organized my copies into two boxes, one with all the nemeses cards, and one with all the hero cards. The games do come with dividers to enable some quicker set up. What I've done since I have both AE and WE is use a label maker to further organize my cards into alphabetical groupings so I can find spells, relics, and gems even quicker.

6. **Each nemesis is different enough so games feel unique in terms of strategy and play**. They are not all beaten by buying the biggest baddest spells and pounding them into oblivion. With the more difficult level villains, you may find it takes you 2-3 tries to defeat them, and you may find yourself having to try different types of player powers and market cards to defeat them. This is where house ruling comes into play. Personally, I enjoy playing each villain first with purely random market cards (gems, relics, and spells). If we are defeated, we start custom choosing our market cards for the next attempt.

7. **The game never feels so complicated and fiddly that you need a notepad or app to track adjustments**. I mentioned Sentinels of the Multiverse as a comparison. SotM is known for its insane levels of fiddliness. Aeon's End does not have that sort of problem. Anything that needs to be tracked is easily done with tokens that go in their required place, and is not complicated. You may find, at most, that you just need to do a minor adjustment or two to your spells' damage levels which can easily be monitored.

8. **Each game takes roughly an hour**. And that's definitely a plus for this type of game. You can easily get in 1-3 sessions in a night. I enjoy this more than say Year 7 of Harry Potter where I have to go through all 7 years of villains in order to beat the final year.

9. **Replayability is not super high**. I don't see myself playing nemeses again and again. Perhaps, after I beat them all, I may try to beat the more fun ones on their advanced difficulty setting, but I'm not even sure about that. This game is fun, but it doesn't get my blood boiling for more plays. I bought this wanting to try a new type of deckbuilder, and bought expansions because there is a guy in my group who LOVES it. There are lots of small ways to tweak a nemesis more to your preference. If you want an easier game or a harder game, you can also adjust HP of the nemesis or city or even heroes.

10. **There is a legacy version coming out later this year.** If you are interested in the game, but want something even more unique, you might consider waiting for that. If you decide to buy AE or WE now, they are compatible with the legacy game. The legacy game is semi-resettable) you need a pack. 

I hope this helps if you're considering buying this. Next week we'll discuss Twilight Struggle!

Previous posts:

[Detective: A Modern Crime Game](https://www.reddit.com/r/boardgames/comments/9b9ekw/10_things_you_should_know_before_buying_detective/)

[Villainous](https://www.reddit.com/r/boardgames/comments/9a9j84/10_things_you_need_to_know_before_buying/)","&lt;!-- SC_OFF --&gt;&lt;div class=""md""&gt;&lt;p&gt;Hello everyone,&lt;/p&gt;

&lt;p&gt;This is my third installment of my weekly reddit post called 10 Things You Should Know, eventually to be shortened to 10TYSK. This week we&amp;#39;re covering Aeon&amp;#39;s End, a deck-building co-operative game by Kevin Riley, published by Action Phase Games and Indie Boards and Games. Each player acts as a mage trying to defeat an extremely powerful nemesis (think Cthulhu types) by casting spells into breaches to deal damage. If the nemesis&amp;#39; HP is drained or his/her deck is depleted before the nemesis destroys the mages or their city, the players win.&lt;/p&gt;

&lt;ol&gt;
&lt;li&gt;&lt;p&gt;&lt;strong&gt;If you love deckbuilding, but hate shuffling, this is the deckbuilder for you.&lt;/strong&gt; You never have to shuffle your deck, you just flip it over to restart it. This adds another layer of strategy as to how you arrange your discard pile to maximize your deck&amp;#39;s efficiency and power.&lt;/p&gt;&lt;/li&gt;
&lt;li&gt;&lt;p&gt;&lt;strong&gt;If you don&amp;#39;t like deckbuilding, there isn&amp;#39;t enough new game here to satisfy you.&lt;/strong&gt; I like to think of this game as a cross between Sentinels of the Multiverse and Big Book of Madness. If those games don&amp;#39;t get you excited, this game probably won&amp;#39;t either. However, I&amp;#39;m not a &lt;em&gt;huge&lt;/em&gt; deck-builder guy in general, but this is my favorite one. I have also played Legendary Encounters Aliens, Marvel Legendary, Harry Potter Hogwarts Battle, Clank, Big Book of Madness, and Dominion. So I do have a little experience with the genre.&lt;/p&gt;&lt;/li&gt;
&lt;li&gt;&lt;p&gt;&lt;strong&gt;Set up and take down are the worst parts of the game&lt;/strong&gt;, and eventually you may want to house rule the way you do this. Before each game you have to construct the deck for the nemesis, your individual starter decks, and you have to randomly build the market with 3 gems, 4 spells, and 2 relics. If you buy enough expansions, this will give a TON of options for each category. But you&amp;#39;ll also eventually find that without certain types of gems, relics, spells, or player powers, winning a game is extremely difficult, if not impossible.&lt;/p&gt;&lt;/li&gt;
&lt;li&gt;&lt;p&gt;As with all co-op deckbuilders, &lt;strong&gt;you may find some games more frustratingly difficult than others&lt;/strong&gt;. However, if you play co-op deck-builders, you probably already know this. Sometimes you just get a brutal combination of cards. This game doesn&amp;#39;t suffer from Harry Potter-like problems where an opening villain combo means you just have to reshuffle before even attempting to beat them, but it can derail your game. The game does have built in tiers of card difficult like Legendary Aliens and Predator, so that helps.&lt;/p&gt;&lt;/li&gt;
&lt;li&gt;&lt;p&gt;&lt;strong&gt;There are essentially two base games&lt;/strong&gt;: Aeon&amp;#39;s End (AE) and War Eternal (WE). You can buy either one and have everything you need to play and add expansions to without buying the other. Buying both will give you double sets of only starter cards like sparks and crystal. Everything else will be unique, so if you want more variations in nemeses, nemeses base cards, spells, relics, or gems, go ahead and buy both.&lt;/p&gt;&lt;/li&gt;
&lt;li&gt;&lt;p&gt;&lt;strong&gt;The artwork is nice, the insert is terrible&lt;/strong&gt;. If you love great inserts, you will find nothing of the kind in this game. It&amp;#39;s cheap cardboard. I have organized my copies into two boxes, one with all the nemeses cards, and one with all the hero cards. The games do come with dividers to enable some quicker set up. What I&amp;#39;ve done since I have both AE and WE is use a label maker to further organize my cards into alphabetical groupings so I can find spells, relics, and gems even quicker.&lt;/p&gt;&lt;/li&gt;
&lt;li&gt;&lt;p&gt;&lt;strong&gt;Each nemesis is different enough so games feel unique in terms of strategy and play&lt;/strong&gt;. They are not all beaten by buying the biggest baddest spells and pounding them into oblivion. With the more difficult level villains, you may find it takes you 2-3 tries to defeat them, and you may find yourself having to try different types of player powers and market cards to defeat them. This is where house ruling comes into play. Personally, I enjoy playing each villain first with purely random market cards (gems, relics, and spells). If we are defeated, we start custom choosing our market cards for the next attempt.&lt;/p&gt;&lt;/li&gt;
&lt;li&gt;&lt;p&gt;&lt;strong&gt;The game never feels so complicated and fiddly that you need a notepad or app to track adjustments&lt;/strong&gt;. I mentioned Sentinels of the Multiverse as a comparison. SotM is known for its insane levels of fiddliness. Aeon&amp;#39;s End does not have that sort of problem. Anything that needs to be tracked is easily done with tokens that go in their required place, and is not complicated. You may find, at most, that you just need to do a minor adjustment or two to your spells&amp;#39; damage levels which can easily be monitored.&lt;/p&gt;&lt;/li&gt;
&lt;li&gt;&lt;p&gt;&lt;strong&gt;Each game takes roughly an hour&lt;/strong&gt;. And that&amp;#39;s definitely a plus for this type of game. You can easily get in 1-3 sessions in a night. I enjoy this more than say Year 7 of Harry Potter where I have to go through all 7 years of villains in order to beat the final year.&lt;/p&gt;&lt;/li&gt;
&lt;li&gt;&lt;p&gt;&lt;strong&gt;Replayability is not super high&lt;/strong&gt;. I don&amp;#39;t see myself playing nemeses again and again. Perhaps, after I beat them all, I may try to beat the more fun ones on their advanced difficulty setting, but I&amp;#39;m not even sure about that. This game is fun, but it doesn&amp;#39;t get my blood boiling for more plays. I bought this wanting to try a new type of deckbuilder, and bought expansions because there is a guy in my group who LOVES it. There are lots of small ways to tweak a nemesis more to your preference. If you want an easier game or a harder game, you can also adjust HP of the nemesis or city or even heroes.&lt;/p&gt;&lt;/li&gt;
&lt;li&gt;&lt;p&gt;&lt;strong&gt;There is a legacy version coming out later this year.&lt;/strong&gt; If you are interested in the game, but want something even more unique, you might consider waiting for that. If you decide to buy AE or WE now, they are compatible with the legacy game. The legacy game is semi-resettable) you need a pack. &lt;/p&gt;&lt;/li&gt;
&lt;/ol&gt;

&lt;p&gt;I hope this helps if you&amp;#39;re considering buying this. Next week we&amp;#39;ll discuss Twilight Struggle!&lt;/p&gt;

&lt;p&gt;Previous posts:&lt;/p&gt;

&lt;p&gt;&lt;a href=""https://www.reddit.com/r/boardgames/comments/9b9ekw/10_things_you_should_know_before_buying_detective/""&gt;Detective: A Modern Crime Game&lt;/a&gt;&lt;/p&gt;

&lt;p&gt;&lt;a href=""https://www.reddit.com/r/boardgames/comments/9a9j84/10_things_you_need_to_know_before_buying/""&gt;Villainous&lt;/a&gt;&lt;/p&gt;
&lt;/div&gt;&lt;!-- SC_ON --&gt;",True,False,False,boardgames,t5_2qmjp,r/boardgames,902470,public,,self,,,10 Things You Should Know before buying Aeon's End:,207,https://www.reddit.com/r/boardgames/comments/9d708k/10_things_you_should_know_before_buying_aeons_end/,[],,False,all_ads,6
