,,False,jreilly89,,,legendary-a-marvel-deckbuilder,"[{'e': 'text', 't': 'Legendary A Marvel Deckbuilder'}]",,Legendary A Marvel Deckbuilder,dark,richtext,t2_dg9q1,,,False,False,,False,,False,1536182557.0,1536153757.0,,,,self.boardgames,0,False,0,False,False,9d6hp8,False,False,False,False,True,False,,,,[],,,dark,text,False,,{},False,,,,[],t3_9d6hp8,False,18,0,,False,all_ads,/r/boardgames/comments/9d6hp8/suggestions_for_a_dice_tower/,False,,,6,False,,,False,11,,{},"I'm looking into getting a dice tower for low dice games like Space Hulk: Death Angel and RPG's. Problem is, last time I had one, it was just extremely noisy (I think because it was only plastic). Does anyone have any suggestions for this or do you have relatively cheap ones you've used that aren't quite as noisy? I'm considering just buying a normal plastic or MDF board one, then gluing some felt to the surfaces.","&lt;!-- SC_OFF --&gt;&lt;div class=""md""&gt;&lt;p&gt;I&amp;#39;m looking into getting a dice tower for low dice games like Space Hulk: Death Angel and RPG&amp;#39;s. Problem is, last time I had one, it was just extremely noisy (I think because it was only plastic). Does anyone have any suggestions for this or do you have relatively cheap ones you&amp;#39;ve used that aren&amp;#39;t quite as noisy? I&amp;#39;m considering just buying a normal plastic or MDF board one, then gluing some felt to the surfaces.&lt;/p&gt;
&lt;/div&gt;&lt;!-- SC_ON --&gt;",True,False,False,boardgames,t5_2qmjp,r/boardgames,902470,public,,self,,,Suggestions for a Dice Tower,11,https://www.reddit.com/r/boardgames/comments/9d6hp8/suggestions_for_a_dice_tower/,[],,False,all_ads,6
,,False,Jacques_Plantir,,,king-of-tokyo,"[{'e': 'text', 't': 'King Of Tokyo'}]",,King Of Tokyo,dark,richtext,t2_w1lba,,,False,False,,False,,False,1536189045.0,1536160245.0,,,,self.boardgames,0,False,0,False,False,9d7fwp,False,False,False,False,True,False,,,,[],,,dark,text,False,,{},False,,,,[],t3_9d7fwp,False,2,0,,False,all_ads,/r/boardgames/comments/9d7fwp/re_endogenesis_gameplay_currently_on_kickstarter/,False,,,6,False,,,False,9,,{},"Hi all,

This game looks deadly in many respects, but my one big concern is lack of significant replayability. The Realm of Knowledge card pool isn't too extensive. Has anyone played on Tabletopia, or any other way, and can comment? It just seems like before long you'd be seeing the same sort of combo appear over and over.

Since the win condition really centers on dealing damage, I'm not sure about the general argument that you can experiment with lots of different play styles. Defensive cards could be handy in the moment, but isn't running one kind of just a stall tactic? Like, eventually you have to ditch that style and just shard up the most efficient damage cards before other ppl do, no?

Maybe a TLDR is that it seems a bit to easily ""solvable""?

Appreciate your thoughts!","&lt;!-- SC_OFF --&gt;&lt;div class=""md""&gt;&lt;p&gt;Hi all,&lt;/p&gt;

&lt;p&gt;This game looks deadly in many respects, but my one big concern is lack of significant replayability. The Realm of Knowledge card pool isn&amp;#39;t too extensive. Has anyone played on Tabletopia, or any other way, and can comment? It just seems like before long you&amp;#39;d be seeing the same sort of combo appear over and over.&lt;/p&gt;

&lt;p&gt;Since the win condition really centers on dealing damage, I&amp;#39;m not sure about the general argument that you can experiment with lots of different play styles. Defensive cards could be handy in the moment, but isn&amp;#39;t running one kind of just a stall tactic? Like, eventually you have to ditch that style and just shard up the most efficient damage cards before other ppl do, no?&lt;/p&gt;

&lt;p&gt;Maybe a TLDR is that it seems a bit to easily &amp;quot;solvable&amp;quot;?&lt;/p&gt;

&lt;p&gt;Appreciate your thoughts!&lt;/p&gt;
&lt;/div&gt;&lt;!-- SC_ON --&gt;",True,False,False,boardgames,t5_2qmjp,r/boardgames,902470,public,,self,,,RE: Endogenesis gameplay (currently on Kickstarter),9,https://www.reddit.com/r/boardgames/comments/9d7fwp/re_endogenesis_gameplay_currently_on_kickstarter/,[],,False,all_ads,6
,,False,Zell211,,,,[],,,,text,t2_sjy3b,,,False,False,,False,,False,1536180978.0,1536152178.0,,,,self.boardgames,0,False,0,False,False,9d69u0,False,False,False,False,True,False,,,,[],,,dark,text,False,,{},False,,,,[],t3_9d69u0,False,10,0,,False,all_ads,/r/boardgames/comments/9d69u0/is_there_any_way_to_get_root_in_europe/,False,,,6,False,,,False,9,,{},"Hello, after reading a lot of things I am ver interested in it. Problem is, I'm in Europe and I can't seem to find any way to get it here.","&lt;!-- SC_OFF --&gt;&lt;div class=""md""&gt;&lt;p&gt;Hello, after reading a lot of things I am ver interested in it. Problem is, I&amp;#39;m in Europe and I can&amp;#39;t seem to find any way to get it here.&lt;/p&gt;
&lt;/div&gt;&lt;!-- SC_ON --&gt;",True,False,False,boardgames,t5_2qmjp,r/boardgames,902470,public,,self,,,Is there any way to get Root in Europe ?,9,https://www.reddit.com/r/boardgames/comments/9d69u0/is_there_any_way_to_get_root_in_europe/,[],,False,all_ads,6
,,False,_OMGWTFBBQ,,,custom,"[{'e': 'text', 't': 'Arcadia Quest'}]",,Arcadia Quest,dark,richtext,t2_fsluv,,,False,False,,False,,False,1536201850.0,1536173050.0,,,,self.boardgames,0,False,0,False,True,9d9k8f,False,False,False,False,True,False,,,,"[{'e': 'text', 't': 'Crowdfunding'}]",cb8c5e48-1d10-11e6-baf6-0e4fba3cf49f,Crowdfunding,dark,richtext,False,,{},False,,,,[],t3_9d9k8f,False,0,0,,False,all_ads,/r/boardgames/comments/9d9k8f/microbrew_kickstarter_thoughts/,False,self,"{'images': [{'source': {'url': 'https://i.redditmedia.com/tashSZ3N3QBYAdrQbp1eyAIQetDw1RvRAPIXgEficlw.jpg?s=27d2a0fefde97fa089577a0e150daa9d', 'width': 560, 'height': 315}, 'resolutions': [{'url': 'https://i.redditmedia.com/tashSZ3N3QBYAdrQbp1eyAIQetDw1RvRAPIXgEficlw.jpg?fit=crop&amp;crop=faces%2Centropy&amp;arh=2&amp;w=108&amp;s=361169295d1716fd530c7c9fe11017ce', 'width': 108, 'height': 60}, {'url': 'https://i.redditmedia.com/tashSZ3N3QBYAdrQbp1eyAIQetDw1RvRAPIXgEficlw.jpg?fit=crop&amp;crop=faces%2Centropy&amp;arh=2&amp;w=216&amp;s=44f668617452fa6cf42ae4fc46cf1e5f', 'width': 216, 'height': 121}, {'url': 'https://i.redditmedia.com/tashSZ3N3QBYAdrQbp1eyAIQetDw1RvRAPIXgEficlw.jpg?fit=crop&amp;crop=faces%2Centropy&amp;arh=2&amp;w=320&amp;s=854d549fe20753bfaaf5582c6fe23962', 'width': 320, 'height': 180}], 'variants': {}, 'id': 'Er3Nl56KbktUhtUaHw4l3TeLmr7Y40xTyTwO-c1S0Z4'}], 'enabled': False}",6,False,,,False,3,,{},"[https://www.kickstarter.com/projects/1707132801/microbrew-a-full-sized-board-game-in-a-tiny-tin](https://www.kickstarter.com/projects/1707132801/microbrew-a-full-sized-board-game-in-a-tiny-tin)

&amp;#x200B;

My initial thoughts is, gameplay looks decent..but I'm not sure about the \~$25CAD for 1 tin = 2players only, and \~$50CAD for 2 tins = up to 4 players pricing.. If it were around Mint Works/Mint Delivery pricing, I would be more interested in backing.. granted, the gameplay for this is definitely heavier than Mint Works/Delivery.","&lt;!-- SC_OFF --&gt;&lt;div class=""md""&gt;&lt;p&gt;&lt;a href=""https://www.kickstarter.com/projects/1707132801/microbrew-a-full-sized-board-game-in-a-tiny-tin""&gt;https://www.kickstarter.com/projects/1707132801/microbrew-a-full-sized-board-game-in-a-tiny-tin&lt;/a&gt;&lt;/p&gt;

&lt;p&gt;&amp;#x200B;&lt;/p&gt;

&lt;p&gt;My initial thoughts is, gameplay looks decent..but I&amp;#39;m not sure about the ~$25CAD for 1 tin = 2players only, and ~$50CAD for 2 tins = up to 4 players pricing.. If it were around Mint Works/Mint Delivery pricing, I would be more interested in backing.. granted, the gameplay for this is definitely heavier than Mint Works/Delivery.&lt;/p&gt;
&lt;/div&gt;&lt;!-- SC_ON --&gt;",True,False,False,boardgames,t5_2qmjp,r/boardgames,902470,public,,self,,,Microbrew Kickstarter thoughts?,3,https://www.reddit.com/r/boardgames/comments/9d9k8f/microbrew_kickstarter_thoughts/,[],,False,all_ads,6
,,False,tomolly,,,,[],,,,text,t2_ar879,,,False,False,,False,,False,1536201212.0,1536172412.0,,,,boardgamegeekstore.com,0,False,0,False,True,9d9gi7,False,False,False,False,False,False,,,,[],,,dark,text,False,,{},False,,,,[],t3_9d9gi7,False,4,0,,False,all_ads,/r/boardgames/comments/9d9gi7/board_game_geek_store_has_300_copies_of_yggdrasil/,False,link,"{'images': [{'source': {'url': 'https://i.redditmedia.com/lYyYESWWA3jPFZ1yU-2UwfWXurAm3UJNf-lIKuvgrbM.jpg?s=6a885c061ce28a351022e33c9915eadb', 'width': 739, 'height': 1000}, 'resolutions': [{'url': 'https://i.redditmedia.com/lYyYESWWA3jPFZ1yU-2UwfWXurAm3UJNf-lIKuvgrbM.jpg?fit=crop&amp;crop=faces%2Centropy&amp;arh=2&amp;w=108&amp;s=1cf4290b50ac6a1d60adb4f4a92e2839', 'width': 108, 'height': 146}, {'url': 'https://i.redditmedia.com/lYyYESWWA3jPFZ1yU-2UwfWXurAm3UJNf-lIKuvgrbM.jpg?fit=crop&amp;crop=faces%2Centropy&amp;arh=2&amp;w=216&amp;s=7f642cca0574d56ac50c45f3797d72ca', 'width': 216, 'height': 292}, {'url': 'https://i.redditmedia.com/lYyYESWWA3jPFZ1yU-2UwfWXurAm3UJNf-lIKuvgrbM.jpg?fit=crop&amp;crop=faces%2Centropy&amp;arh=2&amp;w=320&amp;s=c7260fe9d3fb944bad8e6b0a21d4966e', 'width': 320, 'height': 433}, {'url': 'https://i.redditmedia.com/lYyYESWWA3jPFZ1yU-2UwfWXurAm3UJNf-lIKuvgrbM.jpg?fit=crop&amp;crop=faces%2Centropy&amp;arh=2&amp;w=640&amp;s=8cff474d7dc6a374d221af923fdd16cc', 'width': 640, 'height': 866}], 'variants': {}, 'id': 'YzUdqee4xErf-lz5sTVtK_2ApoHQuPcJZQCdbOAc1vM'}], 'enabled': False}",6,False,,,False,3,,{},,,True,False,False,boardgames,t5_2qmjp,r/boardgames,902470,public,,https://b.thumbs.redditmedia.com/UpdfmYdEpsrxlKzhDX2HSzoiyet6-VUPm6Qr3UvxTWE.jpg,140.0,140.0,Board Game Geek Store has 300 copies of Yggdrasil available for pre-order,3,https://boardgamegeekstore.com/collections/frontpage/products/yggdrasil-2018-printing-preorder,[],,False,all_ads,6
,,False,dvdwebz,,,,[],,,,text,t2_ncyng,,,False,False,,False,,False,1536173971.0,1536145171.0,,,,self.boardgames,0,False,0,False,False,9d5dme,False,False,False,False,True,False,,,,"[{'e': 'text', 't': 'Crowdfunding'}]",cb8c5e48-1d10-11e6-baf6-0e4fba3cf49f,Crowdfunding,dark,richtext,False,,{},False,,,,[],t3_9d5dme,False,21,0,,False,all_ads,/r/boardgames/comments/9d5dme/machina_arcana_new_edition_thoughts_about_this/,False,self,"{'images': [{'source': {'url': 'https://i.redditmedia.com/uXH2qSeJFLIjxp--kiE4l6fVxQZaC9bsFU4xYodu4YQ.jpg?s=1942bf551422b9581d8d943837788f94', 'width': 560, 'height': 315}, 'resolutions': [{'url': 'https://i.redditmedia.com/uXH2qSeJFLIjxp--kiE4l6fVxQZaC9bsFU4xYodu4YQ.jpg?fit=crop&amp;crop=faces%2Centropy&amp;arh=2&amp;w=108&amp;s=c56f3d829865f5e0da98ac773bc8212e', 'width': 108, 'height': 60}, {'url': 'https://i.redditmedia.com/uXH2qSeJFLIjxp--kiE4l6fVxQZaC9bsFU4xYodu4YQ.jpg?fit=crop&amp;crop=faces%2Centropy&amp;arh=2&amp;w=216&amp;s=8646b22a7edbd4be5fa27f9bbd38786c', 'width': 216, 'height': 121}, {'url': 'https://i.redditmedia.com/uXH2qSeJFLIjxp--kiE4l6fVxQZaC9bsFU4xYodu4YQ.jpg?fit=crop&amp;crop=faces%2Centropy&amp;arh=2&amp;w=320&amp;s=542e189a5ec126fb333e8f82803aa667', 'width': 320, 'height': 180}], 'variants': {}, 'id': 'nHNYnu00SMmbVWVepM84NR2NF03VSMQlfU2JOUEEQTs'}], 'enabled': False}",6,False,,,False,10,,{},"Hi!

The new Kickstarter for the new edition of Machina Arcana is up, and it seems like a great game.

I play solo most of the times, so this seems to be a great solo game, can somebody with the first edition tell me more about the game?

Thanks!

KS Link: https://www.kickstarter.com/projects/456615294/machina-arcana-from-beyond/description","&lt;!-- SC_OFF --&gt;&lt;div class=""md""&gt;&lt;p&gt;Hi!&lt;/p&gt;

&lt;p&gt;The new Kickstarter for the new edition of Machina Arcana is up, and it seems like a great game.&lt;/p&gt;

&lt;p&gt;I play solo most of the times, so this seems to be a great solo game, can somebody with the first edition tell me more about the game?&lt;/p&gt;

&lt;p&gt;Thanks!&lt;/p&gt;

&lt;p&gt;KS Link: &lt;a href=""https://www.kickstarter.com/projects/456615294/machina-arcana-from-beyond/description""&gt;https://www.kickstarter.com/projects/456615294/machina-arcana-from-beyond/description&lt;/a&gt;&lt;/p&gt;
&lt;/div&gt;&lt;!-- SC_ON --&gt;",True,False,False,boardgames,t5_2qmjp,r/boardgames,902470,public,,self,,,"Machina Arcana, new edition, thoughts about this game?",10,https://www.reddit.com/r/boardgames/comments/9d5dme/machina_arcana_new_edition_thoughts_about_this/,[],,False,all_ads,6
,,False,baronelectric,,,,[],,,,text,t2_886jn,,,False,False,,False,,False,1536199276.0,1536170476.0,,,,self.boardgames,0,False,0,False,True,9d94na,False,False,False,False,True,False,,,,[],,,dark,text,False,,{},False,,,,[],t3_9d94na,False,15,0,,False,all_ads,/r/boardgames/comments/9d94na/whats_your_preferred_method_to_shuffle_cards/,False,self,"{'images': [{'source': {'url': 'https://i.redditmedia.com/GhVVYf2K9mg-yPO2whtSokMvEmopaNVwJH5fLwqj1z0.jpg?s=7b9a820efb36a6a30fb61e0cf7e754ab', 'width': 250, 'height': 188}, 'resolutions': [{'url': 'https://i.redditmedia.com/GhVVYf2K9mg-yPO2whtSokMvEmopaNVwJH5fLwqj1z0.jpg?fit=crop&amp;crop=faces%2Centropy&amp;arh=2&amp;w=108&amp;s=825ea6aa8d967d28daeb933018a3b6ae', 'width': 108, 'height': 81}, {'url': 'https://i.redditmedia.com/GhVVYf2K9mg-yPO2whtSokMvEmopaNVwJH5fLwqj1z0.jpg?fit=crop&amp;crop=faces%2Centropy&amp;arh=2&amp;w=216&amp;s=415b46b9410bc4500aa709414488f71a', 'width': 216, 'height': 162}], 'variants': {}, 'id': 'bhhoOpsq47dcGe_EhWsLatokUR-yCfi3S9T5s9DucrE'}], 'enabled': False}",6,False,,,False,4,,{},"As game players, I'm sure we've all had to shuffle decks of cards dozens, if not hundreds of times. What's your preferred method of doing so? How do you balance randomness vs. time vs. damage to the cards?

My grandfather taught me the corner riffle shuffle when I was a kid learning how to play cribbage, and I've never felt comfortable using any other method. I can do it quickly (and it achieves a high amount of randomness compared to an overhand shuffle), but the one problem is I tend to do it too hard, so cards start to bend after a long period of time. This is obviously less than ideal if I'm playing something like Magic or a deck-builder where I'm going to be reshuffling a lot.

(https://en.wikipedia.org/wiki/Shuffling if you need a reference)","&lt;!-- SC_OFF --&gt;&lt;div class=""md""&gt;&lt;p&gt;As game players, I&amp;#39;m sure we&amp;#39;ve all had to shuffle decks of cards dozens, if not hundreds of times. What&amp;#39;s your preferred method of doing so? How do you balance randomness vs. time vs. damage to the cards?&lt;/p&gt;

&lt;p&gt;My grandfather taught me the corner riffle shuffle when I was a kid learning how to play cribbage, and I&amp;#39;ve never felt comfortable using any other method. I can do it quickly (and it achieves a high amount of randomness compared to an overhand shuffle), but the one problem is I tend to do it too hard, so cards start to bend after a long period of time. This is obviously less than ideal if I&amp;#39;m playing something like Magic or a deck-builder where I&amp;#39;m going to be reshuffling a lot.&lt;/p&gt;

&lt;p&gt;(&lt;a href=""https://en.wikipedia.org/wiki/Shuffling""&gt;https://en.wikipedia.org/wiki/Shuffling&lt;/a&gt; if you need a reference)&lt;/p&gt;
&lt;/div&gt;&lt;!-- SC_ON --&gt;",True,False,False,boardgames,t5_2qmjp,r/boardgames,902470,public,,self,,,What's your preferred method to shuffle cards?,4,https://www.reddit.com/r/boardgames/comments/9d94na/whats_your_preferred_method_to_shuffle_cards/,[],,False,all_ads,6
,,False,r4sun,,,,[],,,,text,t2_tq54c,,,False,False,,False,,False,1536181295.0,1536152495.0,,,,self.boardgames,0,False,0,False,False,9d6bfi,False,False,False,False,True,False,,,,[],,,dark,text,False,,{},False,,,,[],t3_9d6bfi,False,3,0,,False,all_ads,/r/boardgames/comments/9d6bfi/matte_sleeves/,False,,,6,False,,,False,8,,{},"Hi reddit,

Is there any matte backed sleeves for Standard European size/Mini European size?  The only ones I can readily find are for CCG sized cards.

Thanks!","&lt;!-- SC_OFF --&gt;&lt;div class=""md""&gt;&lt;p&gt;Hi reddit,&lt;/p&gt;

&lt;p&gt;Is there any matte backed sleeves for Standard European size/Mini European size?  The only ones I can readily find are for CCG sized cards.&lt;/p&gt;

&lt;p&gt;Thanks!&lt;/p&gt;
&lt;/div&gt;&lt;!-- SC_ON --&gt;",True,False,False,boardgames,t5_2qmjp,r/boardgames,902470,public,,self,,,Matte Sleeves?,8,https://www.reddit.com/r/boardgames/comments/9d6bfi/matte_sleeves/,[],,False,all_ads,6
,,False,TheRealQwade,,,star-wars-rebellion,"[{'e': 'text', 't': 'Star Wars Epic Duels'}]",a77bb62e-18ab-11e7-bd5b-0e2e3d10e740,Star Wars Epic Duels,dark,richtext,t2_7k2a6,,,False,False,,False,,False,1536204341.0,1536175541.0,,,,self.boardgames,0,False,0,False,True,9d9z3x,False,False,False,False,True,False,,,,[],,,dark,text,False,,{},False,,,,[],t3_9d9z3x,False,0,0,,False,all_ads,/r/boardgames/comments/9d9z3x/games_with_a_huge_variety_of_rulebreaking_factions/,False,,,6,False,,,False,2,,{},"I watched Rahdo's rundown of **Dale of Merchants Collection** and he mentioned that the biggest change in the expansion is the introduction of 55 character cards that all have crazy unique powers to dramatically change each game. It immediately reminded me of **Cosmic Encounter** and all of the races who break the game in various (and often hilarious) ways.

It got me thinking, are there other games like that? I love Cosmic Encounter, but I recently realized that my favorite part is just the alien races and I couldn't really care less about populating other planets or the bargaining with opponents or hand management. Are there other games out there with the potential to change the game experience dramatically in a similar way but with different gameplay mechanics?","&lt;!-- SC_OFF --&gt;&lt;div class=""md""&gt;&lt;p&gt;I watched Rahdo&amp;#39;s rundown of &lt;strong&gt;Dale of Merchants Collection&lt;/strong&gt; and he mentioned that the biggest change in the expansion is the introduction of 55 character cards that all have crazy unique powers to dramatically change each game. It immediately reminded me of &lt;strong&gt;Cosmic Encounter&lt;/strong&gt; and all of the races who break the game in various (and often hilarious) ways.&lt;/p&gt;

&lt;p&gt;It got me thinking, are there other games like that? I love Cosmic Encounter, but I recently realized that my favorite part is just the alien races and I couldn&amp;#39;t really care less about populating other planets or the bargaining with opponents or hand management. Are there other games out there with the potential to change the game experience dramatically in a similar way but with different gameplay mechanics?&lt;/p&gt;
&lt;/div&gt;&lt;!-- SC_ON --&gt;",True,False,False,boardgames,t5_2qmjp,r/boardgames,902470,public,,self,,,Games with a huge variety of rule-breaking factions?,2,https://www.reddit.com/r/boardgames/comments/9d9z3x/games_with_a_huge_variety_of_rulebreaking_factions/,[],,False,all_ads,6
,,False,Darkchylde89,,,,[],,,,text,t2_7u5sv,,,False,False,,False,,False,1536195721.0,1536166921.0,t3_9d87rp,"[{'approved_at_utc': None, 'subreddit': 'horizon', 'selftext': '', 'author_fullname': 't2_xoeka', 'saved': False, 'mod_reason_title': None, 'gilded': 0, 'clicked': False, 'title': 'Horizon Zero Dawnâ„¢: The Board Game!', 'link_flair_richtext': [], 'subreddit_name_prefixed': 'r/horizon', 'hidden': False, 'pwls': 6, 'link_flair_css_class': None, 'downs': 0, 'thumbnail_height': 78, 'hide_score': False, 'name': 't3_9d87rp', 'quarantine': False, 'link_flair_text_color': 'dark', 'author_flair_background_color': None, 'subreddit_type': 'public', 'ups': 38, 'domain': 'facebook.com', 'media_embed': {}, 'thumbnail_width': 140, 'author_flair_template_id': None, 'is_original_content': False, 'user_reports': [], 'secure_media': None, 'is_reddit_media_domain': False, 'is_meta': False, 'category': None, 'secure_media_embed': {}, 'link_flair_text': None, 'can_mod_post': False, 'score': 38, 'approved_by': None, 'thumbnail': 'https://a.thumbs.redditmedia.com/vhTnA0adkMv-b_T3xS-ufD29ruInSyMDswLoHL18GU8.jpg', 'edited': False, 'author_flair_css_class': None, 'author_flair_richtext': [], 'post_hint': 'link', 'content_categories': None, 'is_self': False, 'mod_note': None, 'created': 1536193775.0, 'link_flair_type': 'text', 'wls': 6, 'banned_by': None, 'author_flair_type': 'text', 'contest_mode': False, 'selftext_html': None, 'likes': None, 'suggested_sort': 'top', 'banned_at_utc': None, 'view_count': None, 'archived': False, 'no_follow': False, 'is_crosspostable': False, 'pinned': False, 'over_18': False, 'preview': {'images': [{'source': {'url': 'https://i.redditmedia.com/qywLsxmvFsaI-NngEaFJpauFbeq4bNA7mYbnITql7L0.jpg?s=cad035c678ffad24ec4f568d74b5544d', 'width': 1600, 'height': 900}, 'resolutions': [{'url': 'https://i.redditmedia.com/qywLsxmvFsaI-NngEaFJpauFbeq4bNA7mYbnITql7L0.jpg?fit=crop&amp;crop=faces%2Centropy&amp;arh=2&amp;w=108&amp;s=929ffff96751df60b227bbe7a06d5e58', 'width': 108, 'height': 60}, {'url': 'https://i.redditmedia.com/qywLsxmvFsaI-NngEaFJpauFbeq4bNA7mYbnITql7L0.jpg?fit=crop&amp;crop=faces%2Centropy&amp;arh=2&amp;w=216&amp;s=7824e86cee5600a2ac08d034aced5e7e', 'width': 216, 'height': 121}, {'url': 'https://i.redditmedia.com/qywLsxmvFsaI-NngEaFJpauFbeq4bNA7mYbnITql7L0.jpg?fit=crop&amp;crop=faces%2Centropy&amp;arh=2&amp;w=320&amp;s=5f50de0cc730ae4bc217263167d40086', 'width': 320, 'height': 180}, {'url': 'https://i.redditmedia.com/qywLsxmvFsaI-NngEaFJpauFbeq4bNA7mYbnITql7L0.jpg?fit=crop&amp;crop=faces%2Centropy&amp;arh=2&amp;w=640&amp;s=1e8b9220e3cfe71030c0ea64904420e9', 'width': 640, 'height': 360}, {'url': 'https://i.redditmedia.com/qywLsxmvFsaI-NngEaFJpauFbeq4bNA7mYbnITql7L0.jpg?fit=crop&amp;crop=faces%2Centropy&amp;arh=2&amp;w=960&amp;s=3cad641f20bc1182cb31e8f29e02e01c', 'width': 960, 'height': 540}, {'url': 'https://i.redditmedia.com/qywLsxmvFsaI-NngEaFJpauFbeq4bNA7mYbnITql7L0.jpg?fit=crop&amp;crop=faces%2Centropy&amp;arh=2&amp;w=1080&amp;s=5f7b0748dde0874b1edee5145b9e635d', 'width': 1080, 'height': 607}], 'variants': {}, 'id': 'mDraJHCk1N2CrnNujA6rbRiqFE-FxoF-ijpJoUUxZ68'}], 'enabled': False}, 'media_only': False, 'link_flair_template_id': None, 'can_gild': False, 'spoiler': False, 'locked': False, 'author_flair_text': None, 'visited': False, 'num_reports': None, 'distinguished': None, 'subreddit_id': 't5_2s5h5', 'mod_reason_by': None, 'removal_reason': None, 'link_flair_background_color': '', 'id': '9d87rp', 'report_reasons': None, 'author': 'Steamforged_Games', 'num_crossposts': 1, 'num_comments': 11, 'send_replies': True, 'whitelist_status': 'all_ads', 'mod_reports': [], 'author_flair_text_color': None, 'permalink': '/r/horizon/comments/9d87rp/horizon_zero_dawn_the_board_game/', 'parent_whitelist_status': 'all_ads', 'stickied': False, 'url': 'https://www.facebook.com/steamforgedgames/posts/1962117743827511', 'subreddit_subscribers': 67995, 'created_utc': 1536164975.0, 'media': None, 'is_video': False}]",,facebook.com,0,False,0,False,False,9d8jhm,False,False,False,False,False,False,,,,[],,,dark,text,False,,{},False,,,,[],t3_9d8jhm,False,16,0,,False,all_ads,/r/boardgames/comments/9d8jhm/hopefully_its_not_like_the_doom_fallout_or_dark/,False,link,"{'images': [{'source': {'url': 'https://i.redditmedia.com/qywLsxmvFsaI-NngEaFJpauFbeq4bNA7mYbnITql7L0.jpg?s=cad035c678ffad24ec4f568d74b5544d', 'width': 1600, 'height': 900}, 'resolutions': [{'url': 'https://i.redditmedia.com/qywLsxmvFsaI-NngEaFJpauFbeq4bNA7mYbnITql7L0.jpg?fit=crop&amp;crop=faces%2Centropy&amp;arh=2&amp;w=108&amp;s=929ffff96751df60b227bbe7a06d5e58', 'width': 108, 'height': 60}, {'url': 'https://i.redditmedia.com/qywLsxmvFsaI-NngEaFJpauFbeq4bNA7mYbnITql7L0.jpg?fit=crop&amp;crop=faces%2Centropy&amp;arh=2&amp;w=216&amp;s=7824e86cee5600a2ac08d034aced5e7e', 'width': 216, 'height': 121}, {'url': 'https://i.redditmedia.com/qywLsxmvFsaI-NngEaFJpauFbeq4bNA7mYbnITql7L0.jpg?fit=crop&amp;crop=faces%2Centropy&amp;arh=2&amp;w=320&amp;s=5f50de0cc730ae4bc217263167d40086', 'width': 320, 'height': 180}, {'url': 'https://i.redditmedia.com/qywLsxmvFsaI-NngEaFJpauFbeq4bNA7mYbnITql7L0.jpg?fit=crop&amp;crop=faces%2Centropy&amp;arh=2&amp;w=640&amp;s=1e8b9220e3cfe71030c0ea64904420e9', 'width': 640, 'height': 360}, {'url': 'https://i.redditmedia.com/qywLsxmvFsaI-NngEaFJpauFbeq4bNA7mYbnITql7L0.jpg?fit=crop&amp;crop=faces%2Centropy&amp;arh=2&amp;w=960&amp;s=3cad641f20bc1182cb31e8f29e02e01c', 'width': 960, 'height': 540}, {'url': 'https://i.redditmedia.com/qywLsxmvFsaI-NngEaFJpauFbeq4bNA7mYbnITql7L0.jpg?fit=crop&amp;crop=faces%2Centropy&amp;arh=2&amp;w=1080&amp;s=5f7b0748dde0874b1edee5145b9e635d', 'width': 1080, 'height': 607}], 'variants': {}, 'id': 'mDraJHCk1N2CrnNujA6rbRiqFE-FxoF-ijpJoUUxZ68'}], 'enabled': False}",6,False,,,False,2,,{},,,True,False,False,boardgames,t5_2qmjp,r/boardgames,902470,public,,https://a.thumbs.redditmedia.com/vhTnA0adkMv-b_T3xS-ufD29ruInSyMDswLoHL18GU8.jpg,78.0,140.0,"Hopefully itâ€™s not like the Doom, Fallout, or Dark Souls boardganes. :/",2,https://www.facebook.com/steamforgedgames/posts/1962117743827511,[],,False,all_ads,6
