,,False,longtime_sunshine,,,kemet,"[{'e': 'text', 't': 'A Feast for the Dominion of Burgundy'}]",ff0f090a-18aa-11e7-89cb-0eac4db4cec8,A Feast for the Dominion of Burgundy,dark,richtext,t2_a3n5s,,,False,False,,False,,False,1536108172.0,1536079372.0,,,,self.boardgames,0,False,0,False,False,9cxdbi,False,False,False,False,True,False,,,,[],,,dark,text,False,,{},False,,,,[],t3_9cxdbi,False,40,0,,False,all_ads,/r/boardgames/comments/9cxdbi/dice_tower_west_thread/,False,,,6,False,,,False,38,,{},"I'm very excited to be attending the [Dice Tower West](https://www.dicetowerwest.com/) convention in Las Vegas next year. Anybody else going?

Thought we could get a thread going discussing hotels, tips, tricks, etc as this will be my first time traveling for a convention and am always happy to hear advice from some of you seasoned convention goers :)","&lt;!-- SC_OFF --&gt;&lt;div class=""md""&gt;&lt;p&gt;I&amp;#39;m very excited to be attending the &lt;a href=""https://www.dicetowerwest.com/""&gt;Dice Tower West&lt;/a&gt; convention in Las Vegas next year. Anybody else going?&lt;/p&gt;

&lt;p&gt;Thought we could get a thread going discussing hotels, tips, tricks, etc as this will be my first time traveling for a convention and am always happy to hear advice from some of you seasoned convention goers :)&lt;/p&gt;
&lt;/div&gt;&lt;!-- SC_ON --&gt;",True,False,False,boardgames,t5_2qmjp,r/boardgames,902471,public,,self,,,Dice Tower West Thread,38,https://www.reddit.com/r/boardgames/comments/9cxdbi/dice_tower_west_thread/,[],,False,all_ads,6
,,False,Stixsr,,,,[],,,,text,t2_18dm7kc2,,,False,False,,False,,False,1536138225.0,1536109425.0,,,,self.boardgames,0,False,0,False,False,9d1k5y,False,False,False,False,True,False,,,rules,"[{'e': 'text', 't': 'Rules'}]",e048502e-709a-11e7-9f79-0e36a8135aee,Rules,dark,richtext,False,,{},False,,,,[],t3_9d1k5y,False,15,0,,False,all_ads,/r/boardgames/comments/9d1k5y/games_youve_house_ruled_to_create_a_solitaire_mode/,False,,,6,False,,,False,8,,{},"I just moved and have no gaming group. I have **Onirim** and **Samurai Spirit**, but no other solitaire games. In my desperation, I created a solitaire mode for **Parade** haha.


Anyone else have any interesting solo mode home brews?","&lt;!-- SC_OFF --&gt;&lt;div class=""md""&gt;&lt;p&gt;I just moved and have no gaming group. I have &lt;strong&gt;Onirim&lt;/strong&gt; and &lt;strong&gt;Samurai Spirit&lt;/strong&gt;, but no other solitaire games. In my desperation, I created a solitaire mode for &lt;strong&gt;Parade&lt;/strong&gt; haha.&lt;/p&gt;

&lt;p&gt;Anyone else have any interesting solo mode home brews?&lt;/p&gt;
&lt;/div&gt;&lt;!-- SC_ON --&gt;",True,False,False,boardgames,t5_2qmjp,r/boardgames,902471,public,,self,,,Games you've house ruled to create a solitaire mode?,8,https://www.reddit.com/r/boardgames/comments/9d1k5y/games_youve_house_ruled_to_create_a_solitaire_mode/,[],,False,all_ads,6
,,False,mwrenner,,,eldritch-horror,"[{'e': 'text', 't': 'Eldritch Horror'}]",7f86c588-18aa-11e7-b37c-0ec57a8578b8,Eldritch Horror,dark,richtext,t2_7py77,,,False,False,,False,,False,1536125986.0,1536097186.0,,,,self.boardgames,0,False,0,False,False,9d00a9,False,False,False,False,True,False,,,,[],,,dark,text,False,,{},False,,,,[],t3_9d00a9,False,6,0,,False,all_ads,/r/boardgames/comments/9d00a9/runebound_2nd_edition_frozen_wastes_worth_keeping/,False,,,6,False,,,False,11,,{},I stumbled on a copy for $23 sealed. Is it worth tracking down a copy of the base and play them or sell the thing since it seems to be selling for quite a bit,"&lt;!-- SC_OFF --&gt;&lt;div class=""md""&gt;&lt;p&gt;I stumbled on a copy for $23 sealed. Is it worth tracking down a copy of the base and play them or sell the thing since it seems to be selling for quite a bit&lt;/p&gt;
&lt;/div&gt;&lt;!-- SC_ON --&gt;",True,False,False,boardgames,t5_2qmjp,r/boardgames,902471,public,,self,,,Runebound 2nd Edition: Frozen Wastes worth keeping?,11,https://www.reddit.com/r/boardgames/comments/9d00a9/runebound_2nd_edition_frozen_wastes_worth_keeping/,[],,False,all_ads,6
,,False,AB52169,,,,[],,,,text,t2_go68q,,,False,False,,False,,False,1536131291.0,1536102491.0,,,,self.boardgames,0,False,0,False,False,9d0p8f,False,False,False,False,True,False,,,,[],,,dark,text,False,,{},False,,,,[],t3_9d0p8f,False,4,0,,False,all_ads,/r/boardgames/comments/9d0p8f/whats_the_surface_like_on_the_table_of_ultimate/,False,,,6,False,,,False,9,,{},"I'm just about ready to pull the trigger on getting a game table, and the Table of Ultimate Gaming looks to be nearly perfect for what I'm looking for, but the only thing holding me back is I don't know what the surface feels like.  [Their FAQ](https://ultimategametable.com/pages/faq) describes it as like a mousepad, but from the way it's worded I don't know whether they mean that it's just a giant mousepad or that it has fabric similar to other tables on a mousepad-like base.  Could someone who has or just has been around one of these tables give me a rough idea of how it feels compared to others like Carolina or Geek Chic?","&lt;!-- SC_OFF --&gt;&lt;div class=""md""&gt;&lt;p&gt;I&amp;#39;m just about ready to pull the trigger on getting a game table, and the Table of Ultimate Gaming looks to be nearly perfect for what I&amp;#39;m looking for, but the only thing holding me back is I don&amp;#39;t know what the surface feels like.  &lt;a href=""https://ultimategametable.com/pages/faq""&gt;Their FAQ&lt;/a&gt; describes it as like a mousepad, but from the way it&amp;#39;s worded I don&amp;#39;t know whether they mean that it&amp;#39;s just a giant mousepad or that it has fabric similar to other tables on a mousepad-like base.  Could someone who has or just has been around one of these tables give me a rough idea of how it feels compared to others like Carolina or Geek Chic?&lt;/p&gt;
&lt;/div&gt;&lt;!-- SC_ON --&gt;",True,False,False,boardgames,t5_2qmjp,r/boardgames,902471,public,,self,,,What's the surface like on the Table of Ultimate Gaming?,9,https://www.reddit.com/r/boardgames/comments/9d0p8f/whats_the_surface_like_on_the_table_of_ultimate/,[],,False,all_ads,6
,,False,tutifriend,,,,[],,,,text,t2_k2mk9nt,,,False,False,,False,,False,1536116967.0,1536088167.0,,,,self.boardgames,0,False,0,False,False,9cyptw,False,False,False,False,True,False,,,,[],,,dark,text,False,,{},False,,,,[],t3_9cyptw,False,25,0,,False,all_ads,/r/boardgames/comments/9cyptw/boardgame_room_decoration/,False,,,6,False,,,False,18,,{},"Hi everyone,
I'm moving to a new flat where I will have some space for my boardgames and I would like to decorate the walls with something boardgame related, but I'm running out of ideas. Anybody could tell me some good ones? Thanks ","&lt;!-- SC_OFF --&gt;&lt;div class=""md""&gt;&lt;p&gt;Hi everyone,
I&amp;#39;m moving to a new flat where I will have some space for my boardgames and I would like to decorate the walls with something boardgame related, but I&amp;#39;m running out of ideas. Anybody could tell me some good ones? Thanks &lt;/p&gt;
&lt;/div&gt;&lt;!-- SC_ON --&gt;",True,False,False,boardgames,t5_2qmjp,r/boardgames,902471,public,,self,,,Boardgame room decoration,18,https://www.reddit.com/r/boardgames/comments/9cyptw/boardgame_room_decoration/,[],,False,all_ads,6
,,False,yung_kyle_dee,,,,[],,,,text,t2_zcs6v,,,False,False,,False,,False,1536148947.0,1536120147.0,,,,self.boardgames,0,False,0,False,False,9d2ut8,False,False,False,False,True,False,,,,[],,,dark,text,False,,{},False,,,,[],t3_9d2ut8,False,1,0,,False,all_ads,/r/boardgames/comments/9d2ut8/city_of_iron_2e_question/,False,,,6,False,,,False,4,,{},"When you buy a card such as the â€œdistilleryâ€, it says +1 coin per 3 turnips. If Iâ€™m producing 6 turnips do I receive 2 coins when I buy the card, or between each round during the â€œcollect coins/scienceâ€?","&lt;!-- SC_OFF --&gt;&lt;div class=""md""&gt;&lt;p&gt;When you buy a card such as the â€œdistilleryâ€, it says +1 coin per 3 turnips. If Iâ€™m producing 6 turnips do I receive 2 coins when I buy the card, or between each round during the â€œcollect coins/scienceâ€?&lt;/p&gt;
&lt;/div&gt;&lt;!-- SC_ON --&gt;",True,False,False,boardgames,t5_2qmjp,r/boardgames,902471,public,,self,,,City of Iron 2E question,4,https://www.reddit.com/r/boardgames/comments/9d2ut8/city_of_iron_2e_question/,[],,False,all_ads,6
,,False,AutoModerator,,#d0fffd,,"[{'e': 'text', 't': 'ðŸ¤–'}]",326005ee-9cf2-11e8-8b1f-0e8f9a199476,ðŸ¤–,dark,richtext,t2_6l4z3,,,False,False,,False,,False,1536099128.0,1536070328.0,,,moderator,self.boardgames,0,False,0,False,False,9cvyuz,False,False,False,False,True,False,,,,[],,,dark,text,False,,{},False,,,,[],t3_9cvyuz,True,72,0,,False,all_ads,/r/boardgames/comments/9cvyuz/twoplayer_twosday_september_04_2018/,False,,,6,False,,,False,39,,{},"Chime in here, your weekly place for all things two-player! Sessions, strategy, game recs, criticisms, it all flies here.
","&lt;!-- SC_OFF --&gt;&lt;div class=""md""&gt;&lt;p&gt;Chime in here, your weekly place for all things two-player! Sessions, strategy, game recs, criticisms, it all flies here.&lt;/p&gt;
&lt;/div&gt;&lt;!-- SC_ON --&gt;",False,False,False,boardgames,t5_2qmjp,r/boardgames,902471,public,,self,,,"Two-player Twosday - (September 04, 2018)",39,https://www.reddit.com/r/boardgames/comments/9cvyuz/twoplayer_twosday_september_04_2018/,[],,False,all_ads,6
,,False,BubblyDoo,,,,[],,,,text,t2_1nquv9df,,,False,False,,False,,False,1536189730.0,1536160930.0,,,,self.boardgames,0,False,0,False,False,9d7jnb,False,False,False,False,True,False,,,,[],,,dark,text,False,,{},False,,,,[],t3_9d7jnb,True,7,0,,False,all_ads,/r/boardgames/comments/9d7jnb/for_the_life_of_me_i_cannot_locate_my_copy_of_7/,False,,,6,False,,,False,0,,{},"I have only a few games, being roughly new to boardgaming.

7 Wonders was my very first game purchased. I never opened it, and I never have the total minimum party of 3 to play this. 

I constantly posted/emailed to friends and family that I wanted to play this and actually they obliged for a single play. I was ecstatic!

I searched my closet where I keep my few games and no where can this be found. I tear out boxes, nothing. I look under my bed, nothing. I look in my storage, nothing. 

I look through my emails for the past year, nothing but messages where I stated I wanted to play it or get rid of it if I cannot get a minimum party size of 3. 

Cannot find a email about selling it to anyone on craigslist, no past posting on ebay.

I asked coworkers, and they said they never saw it.

I still cannot locate it.


I am a sad panda I missed my first chance to play this after 1 year of holding onto it. ","&lt;!-- SC_OFF --&gt;&lt;div class=""md""&gt;&lt;p&gt;I have only a few games, being roughly new to boardgaming.&lt;/p&gt;

&lt;p&gt;7 Wonders was my very first game purchased. I never opened it, and I never have the total minimum party of 3 to play this. &lt;/p&gt;

&lt;p&gt;I constantly posted/emailed to friends and family that I wanted to play this and actually they obliged for a single play. I was ecstatic!&lt;/p&gt;

&lt;p&gt;I searched my closet where I keep my few games and no where can this be found. I tear out boxes, nothing. I look under my bed, nothing. I look in my storage, nothing. &lt;/p&gt;

&lt;p&gt;I look through my emails for the past year, nothing but messages where I stated I wanted to play it or get rid of it if I cannot get a minimum party size of 3. &lt;/p&gt;

&lt;p&gt;Cannot find a email about selling it to anyone on craigslist, no past posting on ebay.&lt;/p&gt;

&lt;p&gt;I asked coworkers, and they said they never saw it.&lt;/p&gt;

&lt;p&gt;I still cannot locate it.&lt;/p&gt;

&lt;p&gt;I am a sad panda I missed my first chance to play this after 1 year of holding onto it. &lt;/p&gt;
&lt;/div&gt;&lt;!-- SC_ON --&gt;",False,False,False,boardgames,t5_2qmjp,r/boardgames,902471,public,,self,,,For the life of me I cannot locate my copy of 7 Wonders,0,https://www.reddit.com/r/boardgames/comments/9d7jnb/for_the_life_of_me_i_cannot_locate_my_copy_of_7/,[],,False,all_ads,6
,,False,FedoraPirate,,,resistance,"[{'e': 'text', 't': 'Of course you can trust me'}]",,Of course you can trust me,dark,richtext,t2_b0d2y,,,False,False,,False,,False,1536099388.0,1536070588.0,,,,self.boardgames,0,False,0,False,False,9cw05a,False,False,False,False,True,False,,,,[],,,dark,text,False,,{},False,,,,[],t3_9cw05a,False,47,0,,False,all_ads,/r/boardgames/comments/9cw05a/where_to_get_edible_candy_pandemic_cubes/,False,,,6,False,,,False,25,,{},"For, reasons, I'm looking to get some edible cubes that look lik the disease cubes from pandemic (candy or lollies ideally) but I've been having a real hard time finding them. So I thought I might ask you lovely people if you had any ideas.

Thanks.","&lt;!-- SC_OFF --&gt;&lt;div class=""md""&gt;&lt;p&gt;For, reasons, I&amp;#39;m looking to get some edible cubes that look lik the disease cubes from pandemic (candy or lollies ideally) but I&amp;#39;ve been having a real hard time finding them. So I thought I might ask you lovely people if you had any ideas.&lt;/p&gt;

&lt;p&gt;Thanks.&lt;/p&gt;
&lt;/div&gt;&lt;!-- SC_ON --&gt;",True,False,False,boardgames,t5_2qmjp,r/boardgames,902471,public,,self,,,Where to get edible /candy Pandemic cubes?,25,https://www.reddit.com/r/boardgames/comments/9cw05a/where_to_get_edible_candy_pandemic_cubes/,[],,False,all_ads,6
,,False,AutoModerator,,#d0fffd,,"[{'e': 'text', 't': 'ðŸ¤–'}]",326005ee-9cf2-11e8-8b1f-0e8f9a199476,ðŸ¤–,dark,richtext,t2_6l4z3,,,False,False,,False,,False,1536099122.0,1536070322.0,,,moderator,self.boardgames,0,False,0,False,False,9cvytt,False,False,False,False,True,False,,#cc6500,,"[{'e': 'text', 't': 'Train Tuesday'}]",c501991c-cd40-11e7-8435-0ef2bba51b96,Train Tuesday,light,richtext,False,,{},False,,,,[],t3_9cvytt,True,18,0,,False,all_ads,/r/boardgames/comments/9cvytt/train_tuesday_september_04_2018/,False,self,"{'images': [{'source': {'url': 'https://i.redditmedia.com/gS8fAQ5eXJAJAXO6eEcOpj_n86aQRi6bM_OvOYUSNr8.jpg?s=d7658e2bd46cb051fefc486a097a73df', 'width': 398, 'height': 208}, 'resolutions': [{'url': 'https://i.redditmedia.com/gS8fAQ5eXJAJAXO6eEcOpj_n86aQRi6bM_OvOYUSNr8.jpg?fit=crop&amp;crop=faces%2Centropy&amp;arh=2&amp;w=108&amp;s=f3bb6e00be01b9295e3c21a632f98de1', 'width': 108, 'height': 56}, {'url': 'https://i.redditmedia.com/gS8fAQ5eXJAJAXO6eEcOpj_n86aQRi6bM_OvOYUSNr8.jpg?fit=crop&amp;crop=faces%2Centropy&amp;arh=2&amp;w=216&amp;s=50c80697970276429c223e1ab6cbee7e', 'width': 216, 'height': 112}, {'url': 'https://i.redditmedia.com/gS8fAQ5eXJAJAXO6eEcOpj_n86aQRi6bM_OvOYUSNr8.jpg?fit=crop&amp;crop=faces%2Centropy&amp;arh=2&amp;w=320&amp;s=56b1e24cd443b5c61f5e5aaf98809340', 'width': 320, 'height': 167}], 'variants': {}, 'id': 'myj0_fPegKLqVdy9zJiMpR7hi2yAN-qijLxWaHyTJF8'}], 'enabled': False}",6,False,,,False,24,,{},"
Happy Tuesday, /r/boardgames!

This is a weekly thread to discuss train games and 18xx games, which are a family of economic train games consisting of shared ownership in railroad companies. For more information, [see the description on BGG](https://boardgamegeek.com/boardgamefamily/19/18xx). Thereâ€™s also a subreddit devoted entirely to 18xx games, /r/18xx, and a subreddit devoted entirely to **[Age of Steam](https://boardgamegeek.com/boardgame/4098/age-steam)**, /r/AgeOfSteam.

Hereâ€™s a nice guide on [how to get started with 18xx](https://www.reddit.com/r/boardgames/comments/4sygx3/how_to_get_started_with_18xx/?st=iqny4loj&amp;sh=c01b5d88).

Feel free to discuss anything about train games, including recent plays, what you're looking forward to, and any questions you have. 

If you want to arrange to play some 18xx or other train games online, feel free to try to arrange a game with people via /r/playboardgames.

[Previous Train Tuesday Posts](https://www.reddit.com/r/boardgames/search?sort=new&amp;restrict_sr=on&amp;q=flair%3ATrain%2BTuesday)
","&lt;!-- SC_OFF --&gt;&lt;div class=""md""&gt;&lt;p&gt;Happy Tuesday, &lt;a href=""/r/boardgames""&gt;/r/boardgames&lt;/a&gt;!&lt;/p&gt;

&lt;p&gt;This is a weekly thread to discuss train games and 18xx games, which are a family of economic train games consisting of shared ownership in railroad companies. For more information, &lt;a href=""https://boardgamegeek.com/boardgamefamily/19/18xx""&gt;see the description on BGG&lt;/a&gt;. Thereâ€™s also a subreddit devoted entirely to 18xx games, &lt;a href=""/r/18xx""&gt;/r/18xx&lt;/a&gt;, and a subreddit devoted entirely to &lt;strong&gt;&lt;a href=""https://boardgamegeek.com/boardgame/4098/age-steam""&gt;Age of Steam&lt;/a&gt;&lt;/strong&gt;, &lt;a href=""/r/AgeOfSteam""&gt;/r/AgeOfSteam&lt;/a&gt;.&lt;/p&gt;

&lt;p&gt;Hereâ€™s a nice guide on &lt;a href=""https://www.reddit.com/r/boardgames/comments/4sygx3/how_to_get_started_with_18xx/?st=iqny4loj&amp;amp;sh=c01b5d88""&gt;how to get started with 18xx&lt;/a&gt;.&lt;/p&gt;

&lt;p&gt;Feel free to discuss anything about train games, including recent plays, what you&amp;#39;re looking forward to, and any questions you have. &lt;/p&gt;

&lt;p&gt;If you want to arrange to play some 18xx or other train games online, feel free to try to arrange a game with people via &lt;a href=""/r/playboardgames""&gt;/r/playboardgames&lt;/a&gt;.&lt;/p&gt;

&lt;p&gt;&lt;a href=""https://www.reddit.com/r/boardgames/search?sort=new&amp;amp;restrict_sr=on&amp;amp;q=flair%3ATrain%2BTuesday""&gt;Previous Train Tuesday Posts&lt;/a&gt;&lt;/p&gt;
&lt;/div&gt;&lt;!-- SC_ON --&gt;",False,False,False,boardgames,t5_2qmjp,r/boardgames,902471,public,,self,,,"Train Tuesday - (September 04, 2018)",24,https://www.reddit.com/r/boardgames/comments/9cvytt/train_tuesday_september_04_2018/,[],,False,all_ads,6
,,False,foreigneternity,,,descent,"[{'e': 'text', 't': 'Descent 1E Forever!'}]",,Descent 1E Forever!,dark,richtext,t2_csnce,,,False,False,,False,,False,1536115590.0,1536086790.0,,,,self.boardgames,0,False,0,False,False,9cyijc,False,False,False,False,True,False,,,,[],,,dark,text,False,,{},False,,,,[],t3_9cyijc,False,13,0,,False,all_ads,/r/boardgames/comments/9cyijc/bgg_down_for_anyone_else/,False,,,6,False,,,False,11,,{},"I can't load it at work, but downforeveryoneorjustme.com says it's just me. Never had any problems accessing it before.","&lt;!-- SC_OFF --&gt;&lt;div class=""md""&gt;&lt;p&gt;I can&amp;#39;t load it at work, but downforeveryoneorjustme.com says it&amp;#39;s just me. Never had any problems accessing it before.&lt;/p&gt;
&lt;/div&gt;&lt;!-- SC_ON --&gt;",True,False,False,boardgames,t5_2qmjp,r/boardgames,902471,public,,self,,,BGG down for anyone else?,11,https://www.reddit.com/r/boardgames/comments/9cyijc/bgg_down_for_anyone_else/,[],,False,all_ads,6
,,False,drunkenkoala1122,,,,[],,,,text,t2_ag2gs5,,,False,False,,False,,False,1536101787.0,1536072987.0,,,,self.boardgames,0,False,0,False,False,9cwcqr,False,False,False,False,True,False,,,,[],,,dark,text,False,,{},False,,,,[],t3_9cwcqr,False,12,0,,False,all_ads,/r/boardgames/comments/9cwcqr/rising_sun_oni_bomb_strategy/,False,,,6,False,,,False,22,,{},"We played Rising Sun last weekend and I tried an Oni Bomb Strategy. I was the Dragonfly Clan, and my dragonflies flew around dropping Onis into different provinces! A few observations:

Pros  
\-One of the Winter Upgrade cards was 3 VP per Oni. I ended up with four Onis for 12 points.  
\-A single action (Train or Recruit, no Marshalling required) to get my Onis into place anywhere on the map. As the least honorable clan, this means I can efficiently control multiple provinces, each with a single Oni. What is this good for? Essentially just Harvest, because it is actually...

Cons  
\-Quite useless in battle. Being heavily dependent on a single Oni leaves me vulnerable to Hostage. I am therefore pressured into winning the Hostage action, but since I am lowest in honor this is very costly! In some cases I have to win both Hostage and Ronin actions to win the battle, while losing all tiebreaks on bidding. Extremely poor synergy. If it weren't for all the coins I got from Harvesting, this strategy wouldn't be worth it.

Overall, I think the strategy is workable, and fun to use. I dominated the Harvest action. But I don't think this particular strategy was what won me the game in this instance. Ironically, I seppukued on the penultimate battle of the game to raise my honor, and won the game on honor tiebreak. ","&lt;!-- SC_OFF --&gt;&lt;div class=""md""&gt;&lt;p&gt;We played Rising Sun last weekend and I tried an Oni Bomb Strategy. I was the Dragonfly Clan, and my dragonflies flew around dropping Onis into different provinces! A few observations:&lt;/p&gt;

&lt;p&gt;Pros&lt;br/&gt;
-One of the Winter Upgrade cards was 3 VP per Oni. I ended up with four Onis for 12 points.&lt;br/&gt;
-A single action (Train or Recruit, no Marshalling required) to get my Onis into place anywhere on the map. As the least honorable clan, this means I can efficiently control multiple provinces, each with a single Oni. What is this good for? Essentially just Harvest, because it is actually...&lt;/p&gt;

&lt;p&gt;Cons&lt;br/&gt;
-Quite useless in battle. Being heavily dependent on a single Oni leaves me vulnerable to Hostage. I am therefore pressured into winning the Hostage action, but since I am lowest in honor this is very costly! In some cases I have to win both Hostage and Ronin actions to win the battle, while losing all tiebreaks on bidding. Extremely poor synergy. If it weren&amp;#39;t for all the coins I got from Harvesting, this strategy wouldn&amp;#39;t be worth it.&lt;/p&gt;

&lt;p&gt;Overall, I think the strategy is workable, and fun to use. I dominated the Harvest action. But I don&amp;#39;t think this particular strategy was what won me the game in this instance. Ironically, I seppukued on the penultimate battle of the game to raise my honor, and won the game on honor tiebreak. &lt;/p&gt;
&lt;/div&gt;&lt;!-- SC_ON --&gt;",True,False,False,boardgames,t5_2qmjp,r/boardgames,902471,public,,self,,,Rising Sun - Oni Bomb Strategy,22,https://www.reddit.com/r/boardgames/comments/9cwcqr/rising_sun_oni_bomb_strategy/,[],,False,all_ads,6
,,False,nappy-doo,,,cosmic-encounter,"[{'e': 'text', 't': 'Cosmic Encounter'}]",,Cosmic Encounter,dark,richtext,t2_34ml2,,,False,False,,False,,False,1536031732.0,1536002932.0,,,,self.boardgames,0,False,0,False,False,9cof6t,False,False,False,False,True,False,,,howto,"[{'e': 'text', 't': 'How-To/DIY'}]",00a3aaec-7138-11e7-82b7-0e38c8f4bbce,How-To/DIY,dark,richtext,False,,{},False,,,,[],t3_9cof6t,False,65,0,,False,all_ads,/r/boardgames/comments/9cof6t/i_made_30_giant_meeples/,False,self,"{'images': [{'source': {'url': 'https://i.redditmedia.com/HVP4opkn-l3SKylLY1L2_X4bcPOvgxqjfjgDoXxeEMA.jpg?s=a33b18f191c8011cb7fc449c54aa5273', 'width': 946, 'height': 1262}, 'resolutions': [{'url': 'https://i.redditmedia.com/HVP4opkn-l3SKylLY1L2_X4bcPOvgxqjfjgDoXxeEMA.jpg?fit=crop&amp;crop=faces%2Centropy&amp;arh=2&amp;w=108&amp;s=e2b3ecbc9da3936d173cba1b1bb2a2fd', 'width': 108, 'height': 144}, {'url': 'https://i.redditmedia.com/HVP4opkn-l3SKylLY1L2_X4bcPOvgxqjfjgDoXxeEMA.jpg?fit=crop&amp;crop=faces%2Centropy&amp;arh=2&amp;w=216&amp;s=a6a22127afe5edf3402542e5cdfd2f0f', 'width': 216, 'height': 288}, {'url': 'https://i.redditmedia.com/HVP4opkn-l3SKylLY1L2_X4bcPOvgxqjfjgDoXxeEMA.jpg?fit=crop&amp;crop=faces%2Centropy&amp;arh=2&amp;w=320&amp;s=8d591df70b0594f32487a3ce99305354', 'width': 320, 'height': 426}, {'url': 'https://i.redditmedia.com/HVP4opkn-l3SKylLY1L2_X4bcPOvgxqjfjgDoXxeEMA.jpg?fit=crop&amp;crop=faces%2Centropy&amp;arh=2&amp;w=640&amp;s=c5f5877bffe9dcb0aceeb0395376e547', 'width': 640, 'height': 853}], 'variants': {}, 'id': 'HKYxOWksYkaK-0-8jf_L4zi9tFPoAkkSBEHUZUPaWoE'}], 'enabled': False}",6,False,,,False,522,,{},"My kid goes to preschool, and the teachers use wooden blocks for attendance. The kids put their name and picture on them, decorate them, and the teachers place them around the class in the morning for the kids to find and place in basket to mark attendance. The teacher knows I like woodworking, so she asked me to make blocks for the classroom. As I also like boardgames, I decided to spice the boring blocks up a bit.

I'm keeping one as a first player token.

[Here's a link](https://imgur.com/a/NpueReQ)","&lt;!-- SC_OFF --&gt;&lt;div class=""md""&gt;&lt;p&gt;My kid goes to preschool, and the teachers use wooden blocks for attendance. The kids put their name and picture on them, decorate them, and the teachers place them around the class in the morning for the kids to find and place in basket to mark attendance. The teacher knows I like woodworking, so she asked me to make blocks for the classroom. As I also like boardgames, I decided to spice the boring blocks up a bit.&lt;/p&gt;

&lt;p&gt;I&amp;#39;m keeping one as a first player token.&lt;/p&gt;

&lt;p&gt;&lt;a href=""https://imgur.com/a/NpueReQ""&gt;Here&amp;#39;s a link&lt;/a&gt;&lt;/p&gt;
&lt;/div&gt;&lt;!-- SC_ON --&gt;",True,False,False,boardgames,t5_2qmjp,r/boardgames,902471,public,,self,,,I made 30 Giant Meeples,522,https://www.reddit.com/r/boardgames/comments/9cof6t/i_made_30_giant_meeples/,[],,False,all_ads,6
